id,user_bg_color,user_followers,text,user_description,created,user_location,coordinates,id_str,user_name,user_created,retweet_count,geo
1,9AE4E8,343,The weird and paranoid spins people have tried to put on this are very revealing. https://t.co/pgRXRSN2WB,,2017-03-30T14:18:01,,,847452861814390784,jonpalin,2007-02-09T16:14:23,0,
2,000000,83,"Trump: Yo Mike, should I go grab that women real quick?
Pence: Sure, as long as you arent having lunch with alone
Trump: We're a great team",Evanjellyfish Churchianity,2017-03-30T14:18:02,,,847452865866080257,Jimmmmmy,2015-07-21T13:42:44,0,
3,022330,1254,"@interchris: Mike Pence and his wife are now the new model for a ""healthy"" het marriage, apparently... *eyeroll* It's revolting.",«hysterical kraut bloggeuse» | «angry Black woman» | «Bodenlose Arroganz trieft durch mehrere Antworten» | die «Jil Sander des dämlichen Denglisch»,2017-03-30T14:18:07,,,847452886090956800,_accalmie,2011-11-18T13:50:26,0,
4,B2DFDA,395,"Mike Pence's refusal to be alone with women, writes @emmaogreen, is a standard practice among religious https://t.co/29dneovnAc",scandalized by sin while being saved by grace,2017-03-30T14:18:08,"Hernando, MS",,847452889580584966,ClintWilcke,2011-08-30T13:34:46,0,
5,C0DEED,596,"@sidhubaba is it the mike pence thing? If so, I'd love to talk to you about it, but I dont talk to dudes alone unless my life coach is w/ me","film, media, and communications professor. Radical marxist on the streets, political realist in the sheets. Or maybe it's the other way around.",2017-03-30T14:18:09,"New York, NY",,847452892860530688,gilmored85,2009-02-16T20:40:48,0,
6,F5F8FA,0,Captain America Brown Leather Jacket https://t.co/YSLEvH2RS9 via @eBay #NeverAskAWoman Mike Pence #RepealHB2 #NewPresidentialExpenses,Manufacturer Of Leather Jackets & Costumes.,2017-03-30T14:18:13,,,847452910992506881,UrbanFashionis,2017-03-09T13:07:09,0,
7,7E9895,155,@thecinemasnob in terms of bangability I'd rather fuck Mike Pence.,'I'm Basically Winging It' is going to be the title of my biography.,2017-03-30T14:18:14,"Connecticut, USA",,847452914352140288,miss_catholmes,2009-06-11T22:48:47,0,
8,F5F8FA,77,"""Mike Pence"" With Easter coming-it's a good time to remember that on EASTER  1996 Monica was under Bill's desk, doing- you know. Dems-meh.","Father, Trump supporter, deplorable, irredeemable, conservative, author.",2017-03-30T14:18:17,"Ohio, USA",,847452926352138241,soirredeemable,2016-12-13T01:10:57,0,
9,C0DEED,1290,"Whatever happened, you can rest assured it was a good wholesome loaf of WHITE bread... https://t.co/gMYmWLm8LX",It's a gift and a curse.,2017-03-30T14:18:17,Hiding in plain sight.,,847452929179111428,DimeStoreNinja,2011-05-02T18:39:57,0,
10,F5F8FA,70,"How many of these women,I wonder, would be angry with their man for dining with another woman? Or if they had SnapC… https://t.co/sW9HtdZHjR",Was interested in saving the world. Trimmed those desires.,2017-03-30T14:18:18,,,847452930630238208,TheWestMustWin,2016-09-11T10:53:32,0,
11,000000,1576,Mike Pence can't hang out with women but I'll bet he could if he didn't view women as sexual objects working with satan to have sex with him,"I do #jokes,,,,, #online | Contributor @BraceTheHammer #BLM",2017-03-30T14:18:22,"Indianapolis, IN",,847452947449380865,ChadHoy,2009-05-20T03:12:12,0,
12,000000,43,"How many women can go their entire career without working with men? The fact Pence, &amp; many others, can is not comme… https://t.co/XbsoqKuNNa",Red Vines over Twizzlers,2017-03-30T14:18:22,Cincinnati,,847452949626339329,elizabetseee,2011-10-31T19:03:59,0,
13,C6E2EE,626,"@summerbrennan Of course not, but I'm sure Mike Pence is.","typist and martini mixer, repped by UTA, married to A Terribly Greedy Girl http://amzn.to/2jq2jNZ, was typing about mermaids, now typing about sharks…",2017-03-30T14:18:23,London,,847452952537124866,fredhogge,2009-03-25T08:19:46,0,
14,C0DEED,9,Dead on Mollie. https://t.co/F8KYZeBiQ2,,2017-03-30T14:18:23,United States,,847452950674890755,AllisonKGarwood,2012-03-16T15:10:58,0,
15,EDECE9,2652,I don't eat or drink alone with other men.  Bc I'm married. And I shouldn't. There's no reason to do it. So how is Mike Pence sexist?,"Conservative/libertarian leaning. Jesus, Constitution & Freedom Loving News Junkie. Wife & mom. Despise PC. People have got to lighten up. #CruzCrew",2017-03-30T14:18:24,,,847452954890092545,anotherday1,2009-03-17T11:27:32,0,
16,C0DEED,1756,mike pence can suck five dicks,🇬🇾 ting || SC: jaaaazzyyyy👻 || MCF forever || @ceejay_sortino,2017-03-30T14:18:25,Pace NYC,,847452960531464193,simplyjazzy__,2012-08-10T15:53:44,0,
17,C0DEED,74,How would u ever function in business with an arcane rule like that? Can he try to view women as people rather than… https://t.co/Ho4arXLp0b,Retired. Yogi. Liberal. Persistent as hell. #ResistPersist,2017-03-30T14:18:27,Saint Louis MO,,847452967422656512,katsr,2009-03-05T15:50:17,0,
18,FC9D0F,3027,mike pence's sheets are all rubberized firehose canvas with procreation holes,i'm a comic who does stand up in dark places that sell cheap booze and usually there's people but sometimes there ain't. it's great.,2017-03-30T14:18:28,the underbelly of the leech/dc,,847452972816646144,larsloving,2012-10-31T22:48:26,0,
19,C0DEED,69,"Protecting one's marriage fine. But the way Pence expressed it is weird. As if, whenever left lone w/ANY woman, he'… https://t.co/lOUtBMqwYu",Diplomatic dude.  I know a little about international economics.  I once explained the electoral college on Mongolian TV.,2017-03-30T14:18:28,,,847452973374427136,WendellAlbright,2014-05-07T17:06:52,0,
20,C0DEED,56,Sick https://t.co/kSEauKvUFP,,2017-03-30T14:18:31,SA & FD TX,,847452985613459457,dmouseweb,2009-01-29T17:47:39,0,
21,000000,472,How many Muslims openly drink alcohol? https://t.co/suk49P2q6G,Man in his 30's who complains about PC culture comic books. #FreeKekistan Check out my youtube page or ask me a question: http://ask.fm/capn_cummings,2017-03-30T14:18:31,"Kansas, USA",,847452985294704645,capn_cummings,2016-09-13T00:11:11,0,
22,C0DEED,2531,"""I do not avoid women, Mandrake. But I do deny them my essence."" https://t.co/xAAoa2YVaY",Film Critic. Projectionalist.,2017-03-30T14:18:32,"Boston, MA",,847452991107997697,SeanMBurns,2008-10-22T18:20:56,0,
23,FFFFFF,10238,It presupposes a woman would want to be alone with Mike Pence.,"Partner at your favorite indie bookstore. Writer covering beer, books, and the outdoors. Author of a few books - newest is SKIING MAINE (frm @downeastbooks).",2017-03-30T14:18:32,Coastal Maine,,847452992274022406,jchristie,2008-06-21T01:21:47,0,
24,352726,1696,"Trump will go, and Penis cannot be prez. Criminals cannot profit from their crime! https://t.co/aHcz3Pt1iC","She Persisted.

#ImWithHer",2017-03-30T14:18:34,,,847452997567209481,DailyContessa,2010-06-16T17:30:42,0,
25,131516,1125,"Another thought on Mike Pence, I prefer to do things with my wife whenever possible, because she's much cooler than me. Things are funner.",Give me 15 dollars and I'll change your life. (With a book.),2017-03-30T14:18:37,SATX,,847453010577940480,JMMcDermott,2008-12-16T20:44:56,0,
26,000000,1239,I have so much respect for our VP Mike Pence. He's a very genuine person &amp; I'm so very happy that Trump picked him… https://t.co/RlCqCPLwzA,"Born, Aug. 12 1963, Grad of UMSL BA-Political Science. My Passion is Duck/Goose Hunting with my sons. GOD/FAMILY/DUCKS in that order.",2017-03-30T14:18:38,"Saint Charles, MO",,847453016265379840,GLBourbon,2009-05-29T14:52:58,0,
27,C0DEED,61,"@BraddJaffy we need to get the freedom caucus, the congressional black caucus, and Mike Pence's wife in the same room together, stat!","Chemist, Addiction Researcher",2017-03-30T14:18:41,"NY, NY",,847453030047858688,AddictionChem,2014-03-07T01:52:38,0,
28,BADFCD,703,Manafort &amp; @VP @mike_pence R have been cahoots frm day1. They talk all the time #TheResistance #Indivisible #Resist… https://t.co/0jXRrjAcxJ,Happy. Healthy. Hopeful. #TheResistance,2017-03-30T14:18:42,USA,,847453032543526913,lori_go,2009-01-21T20:07:37,0,
29,C0DEED,779,@liesandperfidy and let's be real: literally no one out of 7 billion+ wants to fuck Mike Pence,impatiently awaiting the return of Giants baseball & Game of Thrones. also a Beer Detective. I have a Jurassic Park tattoo. Punch all nazis. Black Lives Matter.,2017-03-30T14:18:43,"California, USA",,847453037757030400,WolfmanZack415,2011-05-29T23:27:48,0,
30,022330,132,Outrage over Mike Pence's approach to marriage reveals how deeply divided the U.S. is on cultural issues:… https://t.co/wUeoE26UT6,Promoting education and discussion of topics relevant to contemporary American society.,2017-03-30T14:18:44,,,847453042689490944,AmSocietyToday,2011-04-16T13:37:49,0,
31,000000,1704,"Apparently people are upset with Mike Pence. He doesn't want to be alone anywhere with a woman other than his wife.

Why is this important?",Feature Writer @DyeStat. Sports Editor for The @Campbell_Times | Campbell University Undergraduate | CU Big South Conference SAAC Representative,2017-03-30T14:18:45,"Buies Creek, NC",,847453043977105409,KaDeemWynn,2012-05-11T16:22:46,0,
32,000000,174,"I could spend 5 years locked away with the man, and I still wouldn't let him touch me - or speak, smile or even loo… https://t.co/GmmjELw4Y4",Older and wiser...,2017-03-30T14:18:45,"Pennsylvania, USA",,847453044153262081,SusiAaaaaaa,2014-04-01T10:22:19,0,
33,F5F8FA,89,"Mike Pence's showing at the VP debate was a turning point in the election. Kaine wanted a shouting match but Pence was calm, cool, collected",Father. Upstate New Yorker,2017-03-30T14:18:46,Upstate New York,,847453048435650560,theadamwilliam,2016-04-12T14:53:42,0,
34,F70A69,356,But.........why? https://t.co/lTll2j23Lt,UAlbany 20,2017-03-30T14:18:48,,,847453056384057345,targetfan4evr,2012-09-21T22:07:39,0,
35,709397,4295,How did Mike Pence even find his way out of his cave in the first place?,Writer. Filmmaker. (Sometimes) Crowdfunding Consultant. Cynical Asshole.,2017-03-30T14:18:51,The Bar,,847453070762147841,lmcnelly,2008-02-28T00:32:02,0,
36,C0DEED,121,Not too far off. https://t.co/EL81gniIGR via @theonion,Philosophy professor with a pet peeve for crappy arguments.,2017-03-30T14:18:51,Chicago,,847453071139647488,NonsequiturThe,2012-02-07T01:46:36,0,
37,BADFCD,94490,Liberal cat lady infuriated Mike Pence refuses to treat women like Bill Clinton or Teddy Kennedy because some reaso… https://t.co/VUS0JgA2ua,3-Spirit Otherkin because Russians. #Woke | Buy People's Republic | Senior Columnist @Townhallcom | Lawyer | Colonel(R)+ Army War College,2017-03-30T14:18:53,Manhattan Beach CA,,847453076680089600,KurtSchlichter,2008-12-13T00:09:25,0,
38,022330,412,"Maybe if society expected men to behave more like Mike Pence they would be more outraged by ""Grab them by the pussy.""

But ewww breeders",Didn't sell my soul to Putin. Abolish the Designated Hitter.,2017-03-30T14:18:54,"Washington, DC",,847453083416248320,MichaelWatsonDC,2010-03-23T03:44:53,0,
39,C0DEED,2021,Don't forget.. Mike Pence was chosen by Manafort and forced on Trump. He's a Putin Puppet too. He's Putin's back up plan.,,2017-03-30T14:18:57,,,847453096599007232,DianeToucan,2012-02-11T17:54:21,0,
40,F5F8FA,124,"""Mike Pence"" being loyal and caring to his wife somehow is getting Feminist mad this shows that Feminism is a radical left wing ideology",#TEAMTRUMP,2017-03-30T14:18:59,"Florida, USA",,847453103020310531,vhhcjhv,2016-02-23T03:58:30,0,
41,C0DEED,1003,Bingo - #MikePence is an extremist out of touch w/modernity but he's white &amp; nominally Christian so he gets a pass.  https://t.co/TfowsIsXkp,percussion and beagles; futebol and Rothko; history & space; family; home; travel,2017-03-30T14:18:59,blue dot,,847453103167123458,MenaBurke,2011-11-29T14:45:59,0,
42,C0DEED,942,Meanwhile Mike Pence's wife at dinner with the fellas https://t.co/5iqeNkKika,"#Artist #songWriter ✏🎤🎧on DND Productions🎥 #podcastpersonality #suckafree
 #FOLLOW back 👍",2017-03-30T14:19:01,"Baltimore , MD",,847453113204133890,Yarbro22,2010-12-24T21:32:41,0,
43,131516,1282,"so fucking weird. so extremely fucking weird, you guys. https://t.co/U5XRCfeh2U",Tweets about pugs and character actresses,2017-03-30T14:19:02,Harlem ,,847453117104799744,Pschlarm,2011-08-27T16:37:00,0,
44,642D8B,1736,"It's that smirk. Oh, and his insistence on telling women what to do with their vaginas. Gross. https://t.co/MUnYZiJuGr",We will not sit idly by and let Trump ruin our great country. No way no how.,2017-03-30T14:19:04,#TheResistance,,847453122750423040,LeftonPost,2013-01-23T21:21:55,0,
45,C0DEED,161,@BrooklynBlueNy @SheilaGunnReid even Snopes says hol up on that one https://t.co/1pkwBkSgdZ,"156 IQ, Jewish Performance Artist, PhD in understanding the Alt Right, Media CEO, Banker, Lawyer, Nice Jewish boy",2017-03-30T14:19:04,"Kecksburg, Pennsylvania",,847453123878637571,BigTrumpBooty,2014-07-10T10:03:23,0,
46,F5F8FA,142,Mike Pence's devotion to Old World gender role leads to an interesting conversation we can have after Trump is impeached. #dontgetdistracted,"""A just war is better for a man's soul than the most profitable peace."" On November 7, white nationalists declared war on American democracy. #BringItMoFos",2017-03-30T14:19:09,,,847453144095244288,TheAdmiralBoat,2016-02-27T18:59:21,0,
47,0099B9,1794,Pow https://t.co/n66NectbqE,Done playing nice with idiotic libtards. Only a fool doesn't see we best get prepared!,2017-03-30T14:19:09,,,847453143893811202,lmlastla,2013-09-26T22:44:51,0,
48,000000,335,The hoped-for replacement before they can get a Democrat in there in 2020 https://t.co/KswXNFWNo0,"Whale lover, veteran tech guy, anti-Globalist, pro Western values,  anti Animal Cruelty",2017-03-30T14:19:11,"Massachusetts, USA",,847453154258018307,Curucible,2016-09-26T13:29:42,0,
49,C0DEED,9081,"Regressives be like
""Mike pence only eats with his wife that's so weird""

""Bill Clinton cheats on his wife but who cares right?""",Home page of the military of Kekistan. Support our troops. Supreme commander of all Kekistani armed forces. Veteran of the first meme war of 2015-2016,2017-03-30T14:19:12,,,847453156254429185,ArmyofKek,2015-09-10T13:43:35,0,
50,000000,358,Mike Pence finally told me something useful. Now scheduling meals with plenty of married women friends. Love train here I come!,"Runner, writer, thinker. Love Track and field, public policy, and things not being terrible. Owner of Tiny Dog. Opinions my own.",2017-03-30T14:19:13,Seatown,,847453160989900800,rayminchew,2009-12-10T20:22:51,0,
51,000000,2596,Seriously. https://t.co/Q2beU2fDND,"I write about politics and cocktails and LGBTQ stuff, but not usually at the same time. Also I like to be outside a lot. I'm pretty Jewy, too. He/Him.",2017-03-30T14:19:12,"Atlanta, GA",,847453160255799297,rjmedwed,2011-04-29T21:33:31,0,
52,C0DEED,325,Mike Pence is a weird dude and potentially a serial killer https://t.co/fFyXBP54Ui,#Patriots #Knicks #Yankees. #Crossfit junkie who won't stop talking about it just like you'd expect #lovemywife,2017-03-30T14:19:14,,,847453166731800576,Cormination,2009-04-22T22:57:19,0,
53,000000,95,Other down side of Mike Pence story is all the posts from dudes congratulating themselves for being woke bc they dine w/female friends.🙄,Democrat. Born in Buffalo NY. Also have lived in Seattle and Virginia. My blue collar roots keep me grounded while my wonderful family lifts me up.,2017-03-30T14:19:19,"Virginia, USA",,847453187866935297,janicen,2009-02-19T22:15:19,0,
54,C0DEED,96,Sounds to me like Mike Pence used to be r-e-e-e-a-a-l-l-y fun but the law—or his wife—caught up to him. https://t.co/p8P6SgJwhj,"""Strong people don't need strong leaders.""—Ella Baker.
                                         
Don't follow if you don't want to know.",2017-03-30T14:19:19,,,847453188634562560,tsunanymous,2013-10-11T18:04:49,0,
55,000000,269,"Slate, STFU already. #FakeNews

Mike Pence is extremely close to his wife, but that doesn’t mean he respects women: https://t.co/gUJN30hqY2","I am but a simple man. I see Trump related things, I click 'like'.",2017-03-30T14:19:19,"Missouri, USA",,847453189389533188,VictorOfKadesh,2016-11-22T15:30:34,0,
56,000000,2754,"Men have to be taught not to rape, but @MattWalshBlog and Mike Pence are getting crap for not having lunch with women #FFS","Not everyone is going to be literally Hitler. Mix it up. Literally Sauron, Literally PolPot, Literally Stalin. Be creative!",2017-03-30T14:19:20,,,847453189850910721,Mellecon,2013-03-07T20:31:37,0,
57,000000,1755,"How long until this becomes a religious liberty/workplace issue? ""God tells me to interact with women colleagues in… https://t.co/TjTFAGcPaV",Associate editor of @commonwealmag. Former literary editor of @dishfeed. Aspiring dilettante-connoisseur,2017-03-30T14:19:20,"New York, NY",,847453192631803904,MatthewSitman,2012-08-20T07:27:42,0,
58,000000,2778,"Mike Pence is smart, he's making sure some feminazi hag doesn't falsely accused him of sexual harassment","Conservative, Pro-Life, ΜΟΛΩΝ ΛΑΒΕ, #ShootBack #HTTR #LCFC #BlueLivesMatter #AllLivesMatter @Brytani on gab.ai Scotland Look Out! Here I come.",2017-03-30T14:19:21,United States,,847453196503072769,Brytani_Fla,2009-04-29T05:54:34,0,
59,131516,1359,"MIKE PENCE GOES TO ARBY’S
A One-Act Play
:drives up:
FEMALE VOICE: May I help you?
MAKE PENCE (over speaker): [groaning noises, whimpering]","100% official, unverified, progressive-minded blather with hints of music, games, and homoerotic cocktails.",2017-03-30T14:19:22,In your dreams.,,847453201687207937,thelancearthur,2010-05-13T20:52:47,0,
60,022330,106,"I said ""final word."" That means we're done, and anyone tweeting about the subject from now on will be reported to J… https://t.co/JGlSJEaiNm","Saving the world from Ark-stealing Nazis, 140 characters at at time. Fish tweeter. Bryce Harper apologist, apparently",2017-03-30T14:19:26,"Milwaukee, WI",,847453215192788993,aaron_morey,2008-05-19T18:28:09,0,
61,C0DEED,501,Reaction to Wash Post article about Mike Pence's wife was all over the place.  But gotta chuckle at this https://t.co/Zd0RlGlgWr,"Reporter/Anchor at WHEC News 10 in Rochester, NY",2017-03-30T14:19:26,"Rochester, NY",,847453217822621698,WHEC_cmolineaux,2012-07-18T20:08:59,0,
62,F5F8FA,321,Mike Pence after a couple drinks...@KySportsRadio https://t.co/loAg0bk1gW,Just trying to avoid Dixie Highway and Louisville fans. KSR Wannabe - BBN,2017-03-30T14:19:27,Catalina Wine Mixer,,847453219236327424,75toRupp,2016-01-06T16:30:57,0,
63,110033,1476,"More important than who Mike Pence eats with: @EPA Decides Not To Ban A Pesticide, Despite Its Own Evidence Of Risk https://t.co/YX03CDD9Nr","Comms Director at @ABetterMN. MSU Alum. RYT® 200. Categorize me, I defy every label. I have very important thoughts that need to be released. Views=mine 🇲🇽",2017-03-30T14:19:29,"Minnesota, USA",,847453229180780544,rissluna,2010-07-09T16:49:50,0,
64,F5F8FA,113,He probably does it because he doesn't want to be around dumb cunts like yourself. https://t.co/NoeouK83C6,Dating website owner. Asperger Syndrome stay at home dad. I make fun of children on the internet https://www.youtube.com/channel/UCSAEdSAFyeidPD_ifQdTkyw,2017-03-30T14:19:29,,,847453231026364416,JesusNotPenis,2017-02-01T08:33:56,0,
65,000000,74,"If you're a liberal, #NeverAskAWoman if she wished her husband were more like Mike Pence—if she's answering from deep in her heart.","Outlaw King of the Pampas. I accept few followers! 1st to tweet Les Deplorables, bitches...I prefer silver candlesticks, but will take a loaf of stolen bread.",2017-03-30T14:19:31,,,847453236340506625,El__Chorro,2015-07-19T04:56:27,0,
66,C0DEED,11,"@TrancewithMe Issue, for me, is not what Pences do privately, it's that Mike Pence is VP, hence PUBLIC servant. His sex segregation pledge..",,2017-03-30T14:19:34,,,847453250286571520,Yes_Its_Me_S,2013-07-10T19:42:04,0,
67,030302,183,LOL. It truly is absurd beyond parody. https://t.co/YNdOaiCS5t,"IT Security, SharePoint, and Conservative Politics. Foster Parent. Lover of Freedom and Liberty.",2017-03-30T14:19:34,USA,,847453252413136897,FraksMe,2009-06-10T16:13:28,0,
68,C0DEED,767,I think no man should dine alone with any woman who isn't his close relative https://t.co/jwIZa20tfV,A Catholic wife and mother. Who shall find a valiant woman? Far and from the uttermost coasts is the price of her.,2017-03-30T14:19:36,"Texas, USA",,847453259677655040,ValiantWoman45,2015-03-25T01:31:48,0,
69,076656,362,No. Just. No. I do not have to commend Mike Pence for anything. https://t.co/TMyZVrECMd,"person, optimist, plant witch, artist & empath - she/her - always trying. hopefully fighting the good fight.",2017-03-30T14:19:38,California,,847453266237575168,LaurenSlott,2011-10-10T19:36:13,0,
70,022330,564,Wouldn't be surprised if Mike Pence was into that fetish where you dress up and role-play like you're an actual baby. 🍼,🇺🇸: Old soul vybz!✌️// 🇪🇸: ¡Tranqui! ¡Es bromi! 🙃,2017-03-30T14:19:39,,,847453273204207616,KevinSurma,2009-02-05T22:36:36,0,
71,352726,185,so basically what i'm saying is does mike pence know deep down in his heart that he is a rapist?,"if your feminism isn't intersectional, it isn't feminism.",2017-03-30T14:19:45,philly,,847453296415526914,quityourlife,2008-12-11T21:06:29,0,
72,F5F8FA,4001,"We've HAD that before eg Hoover.But never one so VILELY CORRUPT.YEESH as noted, chosen by Manafort.
SUPER dangerous… https://t.co/wK79hemQLW",Virologist. STEM proponent. Physician-Scientist. #ProudSnowflake Well- read in history. Multilingual. #TrumpTreason #TheResistance #TrumpRussia,2017-03-30T14:19:45,,,847453297967415299,Brian_Hjelle,2016-12-11T23:37:20,0,
73,0C0F0B,30789,"Here's a 2-step guide for Matt Walsh and Mike Pence:

1. Think of reasons you'd have dinner with a man.
2. Replace that man with a woman.","Comedy writer, stand-up and improviser in NYC | Political wonk | UCB Student | Chosen for the NBC Late Night Writers Workshop | http://www.36qpodcast.com/",2017-03-30T14:19:48,"New York, NY",,847453309409546240,Pappiness,2009-04-12T21:34:15,0,
74,C0DEED,5617,"“Oh noes women can’t dine alone with Mike Pence what about their careers??”
idk, dude wants them to have funerals for their fetuses.","Writer & editor. Previously: @emilyslist, @AFER, @GavinNewsom, @googletalks. I deserve neither such praise nor such censure.",2017-03-30T14:19:49,"San Francisco, California",,847453314149105664,LisaMcIntire,2010-04-14T23:04:33,0,
75,E81C4F,3650,FACT!! https://t.co/Q4zjP8BDYU,"I'm here to converse and exchange ideas with the cool ones.  

Proudly blocked by Donald Trump and Pastor Darrell Scott.


 Racists can kiss my BLACK ASS!",2017-03-30T14:19:50,EVERYWHERE,,847453315814137856,therealzanetta,2011-11-11T15:42:47,0,
76,000000,254,Mike Pence is a gentleman. God bless and God bless America.,,2017-03-30T14:19:52,,,847453324605509633,Lululemonchello,2013-04-21T22:44:09,0,
77,F5F8FA,2031,Prez @realDonaldTrump was bloviating https://t.co/CC9Zr5cmBE,homemade cookies and handmade signs,2017-03-30T14:19:52,"Manassas, Virginia",,847453326610509824,AlwaystrumpOrg,2016-09-25T21:18:03,0,
78,C6E2EE,4928,Mike Pence Won't Eat Dinner Alone with Any Woman but His Wife — Journalists Want You to Know It's a Scandal https://t.co/N4vG41iqVx,"Labor & Delivery nurse (retired), unrepentant dog rescuer, baseball fan(Cubs, Rangers), mad crocheter, aspiring knitter, gardener, Tea Party Hobbit God Bless TX",2017-03-30T14:19:52,Texas ,,847453326853750785,TruCelt,2009-10-14T04:41:21,0,
79,C0DEED,9,"Mollie, you're exactly right. https://t.co/F8KYZeBiQ2",,2017-03-30T14:19:53,United States,,847453328418119680,AllisonKGarwood,2012-03-16T15:10:58,0,
80,C6E2EE,4928,Mike Pence Won't Eat Dinner Alone with Any Woman but His Wife — Journalists Want You to Know It's a Scandal https://t.co/wWOyeZ5tHg,"Labor & Delivery nurse (retired), unrepentant dog rescuer, baseball fan(Cubs, Rangers), mad crocheter, aspiring knitter, gardener, Tea Party Hobbit God Bless TX",2017-03-30T14:19:53,Texas ,,847453328753569792,TruCelt,2009-10-14T04:41:21,0,
81,C6E2EE,444,Sick burn! https://t.co/IcEeVgoGMH,Aspiring race traitor,2017-03-30T14:19:54,"Fort Worth, Texas",,847453332687863810,emjb,2008-09-28T05:24:48,0,
82,DD2E44,516,This Mike Pence news is nothing new to me. Living in rural Indiana is just like living in the 50s.,Product of 91'. Born in Chicago. Raised in Charlotte. Living in Indianapolis. IU grad. Work for IMS Museum. Activist. My views are my own.,2017-03-30T14:19:55,"Indianapolis, IN",,847453337150771200,lizgalliendawes,2010-09-29T14:58:19,0,
83,642D8B,979,"Does that mean Mike Pence can't meet with Theresa May or Angela Merkel alone, his wife would have to be in the room? Can't be POTUS!",Freelance Make-Up Artist & Romance Writer.,2017-03-30T14:19:56,NYC,,847453343270096897,ShirleyKelly16,2010-09-12T20:28:17,0,
84,E6E6D8,560,Mike Pence's refusal to be alone with women is a standard practice among religious conservatives: https://t.co/xt3Ij6bmC3,Saved by the grace of Bostonian Charm. Realist. MPP. Nonprofit Pro. Lover of Politics and Wine. Unapologetic advocate for the marginalized. Uses humor to cope.,2017-03-30T14:19:57,Chicago,,847453348022280196,EftyTreb,2009-03-30T16:32:02,0,
85,FFFFFF,17422,Three rounds with Mike Pence. No gloves. Wink. https://t.co/Gn3B4yed3F,Scoundrel. Blaggard. Keeper of the NecronomiKindle. Literary Agent at the Bent Agency. Not Paul Rudd.,2017-03-30T14:19:58,"New York, NY",,847453350589218816,byobrooks,2009-02-09T04:04:15,0,
86,C0DEED,193,"@TrancewithMe You seem really bothered that Mike Pence won't have dinner alone with you, says more about you than him","Christian, husband, father, vet",2017-03-30T14:19:58,United States,,847453353093115904,BarryLove15,2015-11-14T17:07:42,0,
