id,user_bg_color,user_followers,text,user_description,created,user_location,coordinates,id_str,user_name,user_created,retweet_count,geo
954,EDECE9,287,"Funny, because it's not *women* she should be worrying about.... https://t.co/o76KUKFdeV",I invented the guy.,2017-03-30T14:38:32,Long Island,,847458024666955777,KAS_712,2011-03-25T15:35:37,0,
955,F5F8FA,111,Do you think Mike Pence made his daughters go to those creepy father daughter dances,an extremely good boy | @GOPSPN2 for additional takes,2017-03-30T14:38:33,Darkmerica,,847458027766546434,GOPSPN_U,2016-02-18T20:03:18,0,
956,000000,1317,"They are attacking ""Mike Pence"" for loving and respecting his wife?  This is a clearest example of why THE PEOPLE hates MSM #FAKENEWS .","I'M AN ARTIST THAT HATES COMMUNISM, FEMINISM AND BELIEVES POT USE IS DEGENERACY",2017-03-30T14:38:34,NONE OF YOUR BUSINESS,,847458031407214594,HERBERTARTIST,2016-03-21T22:51:25,0,
957,352726,2661,"And this is the man who could be our president soon. 😠 Mike Pence May Be Extremely Close to His Wife Karen, but Th… https://t.co/cTYhFLExgx","Sociology professor @ WPU studying politics, militarism, & inequality. Passionate about social justice, feminism, beer, and resisting fascism. All views my own.",2017-03-30T14:38:40,Greater New York City,,847458058804412417,wendyphd,2010-10-05T12:44:53,0,
958,C0DEED,172,Hot take:  I could not care less who Mike Pence has dinner with.,"Husband, New Father, Fan of Orioles, Ravens and Wizards.",2017-03-30T14:38:41,"Arlington, VA",,847458059525931008,Bonzi777,2009-07-09T14:40:44,0,
959,000000,874,Think Trump is scary? Check out Mike Pence on the issues. https://t.co/HWmnCmWYfc via @HuffPostPol,"Mom,Autism Advocate,believe in fairness for all & the Constitution. Will not sit in Silence.Civil rights,clean air,miss Obama",2017-03-30T14:38:41,No TO Trump,,847458060968673280,CandeeSnow,2015-01-09T11:02:57,0,
960,000000,3857,The women upset by Mike Pence treating his wife like a queen WISH they had a man like #Pence Women should be respec… https://t.co/YH0QHyKn1C,"✝️Jesus, Wife, Friend, Conservative,4th Gen Republican in That ORDER Raised in a #ThinBlueLine Family👮🏼The #2A is MY #GunPermit #MAGA #LatinosWithTrump 🎉",2017-03-30T14:38:42,,,847458064173105155,MrsESK,2012-10-08T05:28:45,0,
961,C0DEED,458,Mike Pence Won't Eat Dinner Alone with Any Woman but His Wife — Journalists Want You to Know It's a Scandal https://t.co/2r9blaX7IL,,2017-03-30T14:38:44,"New York, USA",,847458072385667072,angreal3,2015-01-28T03:10:59,0,
962,0099B9,3249,don't kinkshame Mike pence,more tweets about buildings and food,2017-03-30T14:38:44,gem zone,,847458073316704262,ICELEVEL,2010-10-30T18:19:34,0,
963,C0DEED,458,Mike Pence Won't Eat Dinner Alone with Any Woman but His Wife — Journalists Want You to Know It's a Scandal https://t.co/7ucmsOUaZk,,2017-03-30T14:38:44,"New York, USA",,847458074650583041,angreal3,2015-01-28T03:10:59,0,
964,0E0E0F,3612,"Also: keeps Pence squarely in the closet, ensuring his thinly veiled shame spiral into evil. https://t.co/5fJJRZ6gS3",I got Lucky 7's on Emerald Weapon. Repiglican destroyer. Try me. #SMASHFASCISM #justice #governance #atheist #ReproRights #ASPCA #HoustonRockets,2017-03-30T14:38:47,Back in Texas,,847458085576646656,OpressedProgess,2011-01-20T05:42:28,0,
965,FFCC4D,260,"""freaky deakys need love too, Liz Lemon"" https://t.co/GAS3qRv1QT",i'm ready to be a head in a jar // useless tweets no one asked for // ig: @ nikkibexx,2017-03-30T14:38:49,"STL, MO",,847458093889916928,donutforager,2013-05-08T16:09:51,0,
966,F5F8FA,790,"@GrantJKidney ""Mike Pence""

Snowflakes are unable to comprehend morals because their integrity thermometer is broken!

#ThursdayThoughts","YUGE Trump supporter! #NRA #MAGA 
Christian friend of Bill W #LivingSober",2017-03-30T14:38:52,AZ,,847458105529032704,AZunderGOD,2017-02-09T11:27:07,0,
967,000000,820,"""OK but what Mike Pence does is pretty common among Evangelicals"" 

THAT DOESN'T MAKE IT ANY LESS WEIRD OR BAD, YOU FUCKOS.",Pesto | Fellow Traveler,2017-03-30T14:38:53,"Chicago, IL",,847458111593996290,JohnCzahor,2009-03-24T21:10:46,0,
968,1A1B1F,597,"Now all I can think of is this:
https://t.co/g3w2b0lmQR https://t.co/4bB8p0Kruu",It's funny when people have real descriptions here.,2017-03-30T14:38:56,,,847458124218875904,edwardjrathke,2009-02-28T13:18:29,0,
969,000000,3099,"U are 4 the swamp dwellers if u think that, 
Freedom Caucus even fights 4 pple like you who obviously don't get wha… https://t.co/E2LrjZiizE","Conservative, Freedom Fighter, Loves America, Grandma who loves dogs & Grandchildren",2017-03-30T14:38:57,,,847458129352679429,fiteforfreedom,2014-07-17T18:20:01,0,
970,131516,8047,In Mike Pence's defense... there's A LOT of guys who refuse to have dinner with women they aren't having sex with.,"Consultant. Whiskey connoisseur. Cigar aficionado. Gun nut. When in doubt, assume it's sarcasm, even though you won't get it.",2017-03-30T14:38:59,Americas Australia (Florida),,847458135748956161,Singlemaltfiend,2009-09-17T05:15:59,0,
971,C0DEED,368,Does Mike Pence think every woman wants to sleep with him....?,Site expert at Soaring Down South. I work for @elontickets. I'm pretty weird.,2017-03-30T14:39:00,,,847458141214265344,acsnyde,2013-11-03T20:01:37,0,
972,C0DEED,5036,Mike Pence's nutty wife attacked a newspaper for 'promoting homosexuality' https://t.co/WFYlBgzrYn,"#Gay #Activist sharing the BEST of #lgbtnews #politics & #religion, sometimes with a sense of humor/sarcasm!",2017-03-30T14:39:02,Las Vegas,,847458147471990786,RickArtz50,2011-02-03T20:28:28,0,
973,000000,3109,"""Mike Pence"" ** https://t.co/VjcoG2QiZN",FOREIGN EXCHANGE TRADER AND TECHNICAL CURRENCY ANALYST.TRUMP ARMY GENERAL AND PROUD MARRIED WHITE GUY.,2017-03-30T14:39:02,"Panama City Beach, FL",,847458149338456065,forexpcb,2009-04-18T15:50:07,0,
974,0F0F0F,146,"Let's stick to #TrumpRussiaCollusion #TrumpRussiadossier #TrumpTaxReturns #JaredKushner #IvankaTrump #POTUSTrump ""Mike Pence"" is boring! 😴💤",I would just love once to be called sexy. Just because it would make me something other than cute,2017-03-30T14:39:03,Not Far...,,847458153058963456,liljwells,2009-07-29T08:35:10,0,
975,BADFCD,5543,"Have decided to end my solo breakfast discussion of this argument with: no women want to be friends with Mike Pence, let alone eat with him.","'She was warned. She was given an explanation. Nevertheless, she persisted'.",2017-03-30T14:39:03,"Left a bit, then up",,847458153268617217,TheTessMorris,2010-05-12T07:59:08,0,
976,9AE4E8,946,You know what? Think Imma have dinner with Mike Pence's wife and pointedly NOT bang her just to show him how it's done.,"Food, politics & sports. A friendly crank. Practitioner of drunken bonhomie. Can be obnoxiously funny in a juvenile way. Avid Jayhawk lover. Opinions my own.",2017-03-30T14:39:05,"Overland Park, KS",,847458160302587904,gavinesq,2008-10-29T21:36:44,0,
977,9AE4E8,822,LOL https://t.co/u3fxaGlpQ8,"Former philosopher working as a researcher & methodologist. Social science, wine and college football enthusiast.",2017-03-30T14:39:06,Tallahassee,,847458167713812480,tallywineguy,2009-05-28T14:20:10,0,
978,000000,330,That feeling when you have more self control than Mike Pence. https://t.co/BbzFeEIFTv,How DO I get out of this chicken shit outfit?,2017-03-30T14:39:08,Perpetual State of disgust,,847458173610934272,JohnWielgosz,2012-09-18T16:55:08,0,
979,C0DEED,1758,He thought it was a humidor. Honest mistake. https://t.co/MdchLDSLnD,"My only advice. If you send men, send those who are expendable. Grappling with CTE daily. I refuse to lose. Snap: the-bulldog Atlanta",2017-03-30T14:39:08,,,847458175590703104,patterson_mitch,2013-07-01T23:22:25,0,
980,C0DEED,626,Dire que le VP est pire que #Trump... https://t.co/WMZUeGWcNW,"Progressiste de gauche, militant PS/MJS et référent @JeunesMacron89 #EnMarche! Bourguignon, Français et Européen. #TeamMacron #Macron2017 #TeamAJA",2017-03-30T14:39:11,Bourgogne,,847458188714590208,Victor_Albrecht,2012-06-03T12:38:44,0,
981,C0DEED,635,"Haha, #Snowflakes just can't handle defeat can they?

""Mike Pence"" https://t.co/bYuOh240CC","The word ""Nazi"" stands for ""Nationalsozialistische Deutsche Arbeiterpartei"" - the National Socialist German Worker's Party. liberals they were!",2017-03-30T14:39:15,USA,,847458204237705216,lkaPolitical,2012-12-18T13:05:30,0,
982,C0DEED,453,"In my ideal world, this is all an excuse made up because no woman has ever wanted to dine with Mike Pence.",Former Animator/Jedi Council @projectmgame | Editor @TheMarySue | Weird Uncle | RT = the strongest man ... in the world,2017-03-30T14:39:17,"Raleigh, NC",,847458211376517122,Dan_Van_Winkle,2013-10-06T17:27:28,0,
983,9AE4E8,6084,"I guess Pence can't stop staring at other women's filthy, alluring mouth holes, wet and masticating. Then the engul… https://t.co/njBH9n8Jcp","overanalyzes everything and really, really, really wonders why.",2017-03-30T14:39:19,San Francisco,,847458218892709894,lizhenry,2006-11-27T03:50:52,0,
984,C0DEED,2185,He's hiding something for sure. https://t.co/Bfx3HhSA4M,"Fine Art practice. Quemadmoeum gladis nemeinum occidit, occidentis telum est.",2017-03-30T14:39:18,Everywhere and Nowhere,,847458218540322817,nametyb,2009-04-03T18:51:41,0,
985,FFF04D,463,"Nice that Mike Pence loves his wife, but c'mon, you're not Billy Graham. This meal policy makes it harder for female colleagues to advance.","Historical musings and Catholic opinions. Pro-old churches, anti-scrupulosity. Member of #cathsorority. @SarahLVDuggan is my museum alter-ego.",2017-03-30T14:39:20,"New Orleans, LA",,847458223409864704,CopperLampSarah,2009-06-15T21:20:51,0,
986,709397,36,"This should be their personal guideline, it's their relationship. https://t.co/Yvmsjd1ZQW","Artist who believes in honesty, creativity, integrity, humanity, and being a proud liberal! #notmypresident #TheResistance",2017-03-30T14:39:20,North Carolina,,847458224320032768,Bubbette23,2008-10-01T18:31:58,0,
987,642D8B,2746,@kashanacauley i don't even want to be alone with a picture of Mike Pence. #CreepyRepressedNaziMotherfucker,Kinetic Poet. I love everyone. Including you stupid fuckers. Buddagnostifarian (Orthodox),2017-03-30T14:39:22,Seattle,,847458231462969347,danmonaghan,2008-09-28T15:36:28,0,
988,352726,243,A whole lotta yikes right there. https://t.co/FSg6EOGgdL,*tweets furiously*,2017-03-30T14:39:22,the wilds of western WA,,847458235044970498,0llie0llie,2010-03-15T08:40:02,0,
989,642D8B,338,😂👏🏼👏🏼👏🏼 https://t.co/LiZvAGYAsy,"Animation Film Editor at Disney.  Feminist, long distance runner, wife to 1 and mother to 2.  Live, laugh, and love with all of my heart!",2017-03-30T14:39:23,"Los Angeles, CA",,847458235510542336,ibgecko,2009-02-22T23:31:14,0,
990,022330,2363,"The Internet Roasts Mike Pence for Refusal to Dine Alone With Women Other Than His Wife
https://t.co/QzrTpiB4LS …… https://t.co/NM2Pzffpfn",Marketing specialist and writer with a focus on social justice causes and film #comicbooks http://bitly.com/1n2scgh,2017-03-30T14:39:22,"Toronto, ON",,847458235401420800,HeardAndrew,2012-02-11T16:29:05,0,
991,C0DEED,320,"@jeremynewberger I don't think Mike Pence is the one with the problem.
#SeekTherapy",Twitter is terrible.,2017-03-30T14:39:24,,,847458243345432577,WrongSort,2014-03-30T01:03:08,0,
992,000000,458,"""Can't be"" is a bit of a stretch from ""don't want to be"". You're jumping at shadows https://t.co/EFinYF9vsa",Views are @jk_rowling's,2017-03-30T14:39:26,,,847458249158778880,TheUnsafeSpace,2015-04-28T23:37:49,0,
993,000000,2383,"@Slate = Hate

Mike Pence is extremely close to his wife, but that doesn’t mean he respects women: https://t.co/6xwwCQ7qJm via @doublexmag","The stupidity of intelligent people is on full display see MSM. Proud college educated Trump supporter 1a, 2a & Voter ID are keys to a republic. Punk",2017-03-30T14:39:29,United States,,847458261796175874,themefromajackl,2012-01-10T16:35:10,0,
994,C0DEED,1754,"And Podesta, Hillary? https://t.co/JvFNYZDhoe","TROLLS will be blocked, NO LISTS

Conservative Floridian,
South Florida, 
#MAGA Trump/Pence",2017-03-30T14:39:31,"Florida, USA",,847458269857697793,7777MYNAME,2011-01-30T11:44:26,0,
995,000000,2756,I find it funny that people bagging on Mike Pence and Matt Walsh think its only the man who follows those rules.  You people suck.,"Not everyone is going to be literally Hitler. Mix it up. Literally Sauron, Literally PolPot, Literally Stalin. Be creative!",2017-03-30T14:39:31,,,847458271237611522,Mellecon,2013-03-07T20:31:37,0,
996,C0DEED,5283,"Just discussed on the Patrick Madrid Show
https://t.co/6g7mKOYHvn
https://t.co/gXV9jUcHcL",This is the official Twitter page for The Patrick Madrid Show on @ihradio. It is ranked as the most-listened-to show on Catholic radio!,2017-03-30T14:39:31,"Sacramento, CA",,847458272110034946,PMadridShow,2015-01-30T15:17:48,0,
997,BADFCD,3567,"American Taliban, all of them. ISIS and these guys should just get a room already. Far away from here. https://t.co/4XZnniGJvL","Language journalist. Bylines Science, Wired, Atlantic, NY Times, Aeon, Slate, etc. Author, UM... & BABEL NO MORE. Working on book #3",2017-03-30T14:39:33,,,847458277789220865,michaelerard,2009-07-26T20:55:55,0,
998,F5F8FA,65,At least Mike Pence is not grabbing pussies or mocking disabled people or lying with every word he speaks. Like someone else we know!,Resist the Donald's tyranny!,2017-03-30T14:39:33,,,847458280989380608,clutzbuffrap,2017-01-12T06:12:53,0,
999,1A1B1F,1492,"This whole Mike Pence thing is not so much Christian or conservative as elderly, IMHO.","Publisher, http://First-Draft.com. Doing my best to kill journalism.",2017-03-30T14:39:33,Chicago,,847458281459077121,Athenae,2008-02-15T20:45:52,0,
1000,000000,782,Mike Pence is confusing cuz idk what part of Christianity doesn't allow you to occupy the same room as a woman alone,always looking for peace of mind.,2017-03-30T14:39:34,The Other America,,847458282251759616,OJTheNigerian,2015-07-07T19:07:17,0,
1001,000000,24175,i wonder if mike pence’s co-locational chastity program applies to female members of his secret service detail,I run digital investigations for Gizmodo Media Group. Email: john@gizmodomedia.com. PGP Key: http://johncook.kinja.com/john-cooks-public-pgp-key-1677601657,2017-03-30T14:39:35,"yes, jersey",,847458289369600001,johnjcook,2009-04-25T19:56:28,0,
1002,F5F8FA,10,😂 https://t.co/8V2b12OSeW,I probably don't like you,2017-03-30T14:39:36,"Everett, WA",,847458293396013057,_MrsMiaWallace,2017-02-09T01:35:32,0,
1003,F5F8FA,51,"Bar graphs are Why Trump Won, tbh. https://t.co/EDzONMJD6x","Part-time Monarchist, Part-time Luddite. Illiberal Catholic. #epikeia",2017-03-30T14:39:37,Hyrule,,847458294604091392,gotcherknows,2017-02-09T15:36:30,0,
1004,000000,439,Not wrong. https://t.co/U9liLDCvQx,"Events @Slate, @FutureTenseNow. Formerly @NewAmerica, @NewAmericaNYC. Okie by birth, Argentine by marriage. Mom.",2017-03-30T14:39:37,"Washington, DC",,847458295849771009,TheFaithSmith,2013-11-19T17:25:04,0,
1005,C0DEED,13992,I been 'round them chuch folk long enough to know the game https://t.co/UHRNYAJk6M,"Now I am become sarcasm, destroyer of worlds. Cogito ergo sumbitch ipso facto vis a vis hold deez. Refer any complaints to my lawyers Argle, Bargle and Sputum.",2017-03-30T14:39:38,Holdin BOFA on yo Mama's sofa,,847458301784727553,eclecticbrotha,2011-05-18T03:22:30,0,
1006,BADFCD,5063,"This Mike Pence storytime is Trump trying desperately to DEFLECT from the ""very mean, look why not go after Hillary"" #TrumpRussiaCollusion",I'm 41 yrs. old. Did 10 yrs. in retail. Bride-to-be.L.A. foodie..on instagram also. sugar addict. my goal is to try All the craft beers ever made!! #resist,2017-03-30T14:39:43,"Burbank,ca",,847458322068504577,Goodluckbeer,2009-06-04T20:38:24,0,
1007,C0DEED,143,"@Amy_Siskind To be fair, I'm sure a lot of women aren't comfortable in the company of Mike Pence.","Teacher, Writer, Golfer & Traveler",2017-03-30T14:39:46,Denver,,847458332055089152,JasperJ77,2010-04-13T01:17:02,0,
1008,F5F8FA,120,Obvious point but it's hilarious that the people attacking Mike Pence's marriage largely have never been married themselves.,current Rice U Student | @weeklystandard and former @LifenewsHQ intern. | @CollegeFix writer | normal in real life,2017-03-30T14:39:46,,,847458335695568898,cb0321,2015-12-18T23:40:24,0,
1009,F5F8FA,883,There has got to be a way for @Support @Twitter to purge these bot/troll Russian accounts. https://t.co/HZ4B3DWx27,"A wife, mom to a toddler & Texan democrat with a gun that Obama never touched. Impeach the fake president! #notmypresident #stillwithher #theresistance",2017-03-30T14:39:48,"Texas, USA",,847458342012305408,CResisting,2016-09-27T15:27:57,0,
1010,642D8B,27416,"it's not ""sweet"" that Mike Pence can't trust himself around women besides his wife. it's creepy that he thinks he has no self control.",#allblacklivesmatter #Shiagenocide #NoDAPL,2017-03-30T14:39:51,NY ,,847458353580081152,farwzz,2012-06-29T00:37:40,0,
1011,000000,288,"The left bash Mike Pence for being too respectful too his wife, pander to Islam, but are the Women's rights party because they kill fetuses?","If you think the government is the answer, I'm probably the guy you won't talk to at a dinner party.",2017-03-30T14:39:52,"Indiana, USA",,847458361264062465,MReberger,2011-08-14T01:22:03,0,
1012,C0DEED,872,🤢 https://t.co/NY038l2NAj,just some dickhead with a phone,2017-03-30T14:39:52,Halfway between DC & NYC,,847458361108869120,TheChiefAlbert,2009-05-26T22:47:04,0,
1013,EBEBEB,1622,The same people making fun of Pence for his high standards also made fun of Weiner for his low standards. Not easy… https://t.co/ZqaLPgYwN8,"Wife. Mommy of three. Author, tear-wiper and muffin baker. Evangelist for romantic hope and the possibility of innocence.",2017-03-30T14:39:52,"Toronto, Ontario",,847458361251581952,wendyshalit,2009-02-02T16:49:29,0,
1014,470099,535,😲😲My Fucking Hairrrrrrrrr............ https://t.co/rf1AAGoWeU,"I will shoulder my musket and brandish my sword, In defense of this Land & the word of Me. ""Luctor Et Emergo""",2017-03-30T14:39:54,Netherlands,,847458366578245633,RichardSewAtjon,2009-07-09T22:38:49,0,
1015,F5F8FA,278,"I agree....,@VP ! https://t.co/dReYgqE06j",,2017-03-30T14:39:56,,,847458377017868288,avonet5555,2016-04-14T02:05:50,0,
1016,DD2E44,5783,"Mike Pence calling his wife ""mother"" is just as wrong as calling Donald Trump ""President.""",This is not a safe space.,2017-03-30T14:39:57,"Marysville, Ohio",,847458382072102912,OriginalLeeMays,2009-03-06T02:19:57,0,
1017,000000,2517,"Oh Mike Pence is def. imagining ""nights of boys-only carousing"". https://t.co/yhHMW6lz4H","Daughter, Aunt, Sister, Social Worker.   #theResistance #NeverTrump #NotMyPresident",2017-03-30T14:40:03,,,847458403718840320,amawheel,2016-09-27T02:53:50,0,
1018,C0DEED,2185,Yep! https://t.co/mXZYFtjNEl,"Fine Art practice. Quemadmoeum gladis nemeinum occidit, occidentis telum est.",2017-03-30T14:40:04,Everywhere and Nowhere,,847458407825133568,nametyb,2009-04-03T18:51:41,0,
1019,C0DEED,405,"Wait.. liberals are now mocking the man for his beliefs &amp; practices? Im so confused. Aren't they the accepting, tol… https://t.co/mVR7A0tKcO","''Know the rules well, so you can break them effectively.'' - Dalai Lama XIV",2017-03-30T14:40:04,USA,,847458407523024897,Tbone_1218,2014-04-16T18:11:29,0,
1020,FFFFFF,802,"Honestly, who wants to be alone with Mike Pence anyway?","THE ULTIMATE IN SCIENCE FICTION™ STATE OF THE ART™ THIS IS NOT YOUR PARENTS CARTOONS™ PRO-SCIENCE ATHEIST LIBERAL®
STRAIGHT JACKIN' SAVES YOU THAT MAD CREME™",2017-03-30T14:40:08,New Orleans,,847458424765861889,superdeformed,2008-03-18T21:19:54,0,
1021,F5F8FA,490,I'll stop judging Mike Pence's marriage when he stops trying to fuck with mine.,"All right fine, crybaby. Just tie him up and maybe I guess gag him. But at the first sign of trouble I want you to at least break both his knees.

🌹🏳️‍🌈☭",2017-03-30T14:40:10,,,847458433532010497,refurbsexbot,2016-11-18T17:34:04,0,
1022,C0DEED,3,What tf is going on.. you hate mike pence for respecting his wife??? That just settles it then. Non of you care about our country. Gtfo,fuck philly,2017-03-30T14:40:10,,,847458434391752705,ItsYaCowboy99,2015-07-16T22:18:54,0,
1023,DD2E44,38,Damn that dude really wants to have dinner with Mike Pence.,"Blob Nite truther. Your dad's takes on #iubb are most likely bad. ""Indiana brass."" GO UTAH JAZZ 🎺 Nate McMillan face memes from here on out.",2017-03-30T14:40:11,Bloomington of course,,847458439156514817,Rojobowl,2015-05-01T01:19:45,0,
1024,022330,700,One time Mike Pence spent a few too many seconds watching a waterfall so he had to strangle a squirrel with his bare hands to clear his mind,Let me go down as waves sweep to the shore @demsocialists,2017-03-30T14:40:11,"Fort Worth, TX/Hanover, NH",,847458439592787968,RibosomeChomsky,2010-05-08T23:19:38,0,
1025,C0DEED,3318,Not really 😩 (This clearly reflects your culture's misogynist view that women are only valued as possible future se… https://t.co/clJw6rJod4,"Pinko Space Witch with a chronic illness, a passion for vintage, & a blog about thrifting. I am a fucking delight! http://society6.com/carrieannecastillo",2017-03-30T14:40:12,California's Central Valley,,847458445083131910,exlibris,2007-12-19T04:04:46,0,
1026,381A00,125,@keplyq that's why I want Mike Pence to buy me dinner.,living and eating burritos. new mommy.,2017-03-30T14:40:13,plymouth,,847458446257438724,lambwaffle,2007-11-10T18:13:03,0,
1027,C6E2EE,389,i've gone from being morbidly curious to terrified of the eventual reveal of whatever sick stuff Mike Pence is actually into,friend of the show,2017-03-30T14:40:13,in transit,,847458449000509441,popespeed,2010-04-23T15:31:18,0,
1028,131516,354,i don't find the positions of mike pence and matt walsh weird. if you want to stay faithful why put yourself in a position to be unfaithful?,,2017-03-30T14:40:14,dc/md,,847458452204945408,DSGNTD_PLYR,2011-06-29T14:11:04,0,
1029,C0DEED,738,Mike Pence is not an insecure man,"83 win Yanks

DTF...down to fish",2017-03-30T14:40:15,Jersey,,847458456621563905,HeelDowlin__,2009-05-16T13:40:15,0,
1030,C0DEED,1130,I guess twitter found out mike pence was a religious freak,same hero new boots,2017-03-30T14:40:16,"Houston, TX",,847458461101170689,The_clark_Side,2011-12-07T02:30:15,0,
1031,FFF04D,2295,"If @VP Mike Pence encourages other men (and women) into better behavior that is great, but there is no mandate. People need to calm down.","Looking to share and connect with the world. Christian. Conservative Independent. Living my Life Like Its Golden. I don't like haters, so if u r 1 stay away.",2017-03-30T14:40:18,"Houston, TX",,847458469934387201,Kimmy1Queen,2013-01-03T21:17:22,0,
1032,0E0D02,10209,Someone find Milo. Pence is the spitting image of a daddy. https://t.co/gIGoKreFpI,"Professional eccentric, amateur normal, natural alien, all around taken for granted doormat, looking up society's skirts and writing about it on the net.",2017-03-30T14:40:19,Earth,,847458471687606272,Wojciehowicz,2009-09-14T15:08:20,0,
1033,000000,3857,The women upset by @MikePenceVP treating his wife like a queen WISH they had a man like #Pence Women should be resp… https://t.co/1oElp1Fx31,"✝️Jesus, Wife, Friend, Conservative,4th Gen Republican in That ORDER Raised in a #ThinBlueLine Family👮🏼The #2A is MY #GunPermit #MAGA #LatinosWithTrump 🎉",2017-03-30T14:40:20,,,847458476120920071,MrsESK,2012-10-08T05:28:45,0,
1034,1A1B1F,307,"This is, I'm afraid, a fair point. Doesn't make Pence's ""rule"" legit, but points to the deeper problem. https://t.co/TIRivWsJCq","I'm an assistant director in TV, but this is where I get to be a fan of music, film & TV, and have fun. Occasionally NSFW.",2017-03-30T14:40:21,Los Angeles,,847458479572779009,Choose2Live,2009-04-26T03:05:45,0,
1035,F5F8FA,31,"The left bash Mike Pence for being too respectful too his wife, pander to Islam, but are the Women's rights party because they kill fetuses?",GiveawayQallo is giving away 2 New iPhone 7 Plus (worth $969) for 2 Winners every week! JOIN to WIN! Take 2 min to FOLLOW the step on my pinned tweet!!,2017-03-30T14:40:21,United States,,847458480692764676,giveawayqallo,2017-03-13T13:52:22,0,
1036,8FB093,693,What a load of happy horseshit and passive-aggressive sexism. https://t.co/GlWR1Aj3L8,"Scientist & Bear's Wife. Separation of Church & State. Science will save us, not Evangelicals. The truth is out there if you only look. #resist",2017-03-30T14:40:21,United States,,847458482273923073,MishaLawless,2014-01-11T04:18:49,0,
1037,0084B8,51567,Mike Pence is not weird for refusing to eat alone with any woman who isn't his wife. https://t.co/RS4DG8aDMp,Political commentator. YouTube person. Animal lover.,2017-03-30T14:40:24,,,847458494236065793,JulieBorowski,2010-02-22T01:30:24,0,
1038,642D8B,842,"man respects his wife which most women dont get cuz their standards r so low,all they know what2 do is make fun of… https://t.co/AlAkizcLE7","REAL bears.white sox.blackhawks.bulls fan #beardown #bearsnation • i love sports talk radio • i love being tall, sarcastic • i love America 🇺🇸",2017-03-30T14:40:25,,,847458496799035392,45_darcy_45,2009-05-05T03:11:56,0,
1039,000000,573,"Awww, such a pretty boy . . . 
""Mike Pence"" https://t.co/fTrvKSvWiV",A ravenous reader of politics and intentional truster of people. Unshakeable believer in compassion's power and my child's possibilities. #liberal #Imwithher,2017-03-30T14:40:26,"Austin, TX",,847458500426977280,scoff2law,2014-08-12T01:59:35,0,
