id,user_bg_color,user_followers,text,user_description,created,user_location,coordinates,id_str,user_name,user_created,retweet_count,geo
1375,000000,254,Thrusting olympics. https://t.co/8OND0XZScS,Just a kid from Lansing. Marketing @the14thfactory. Come on by. support@the14thfactory.com,2017-03-30T14:47:36,"Los Angeles, CA",,847460305642733568,jocypocy,2015-02-25T16:08:55,0,
1376,F5F8FA,0,"⚡ Mike Pence does not dine alone with women without his wife

https://t.co/ztmRrKj0Z6 as it should be,media would make up lied if he did",Political News,2017-03-30T14:47:41,over there pa,,847460325901254657,tyrone5_cent,2016-09-14T11:00:08,0,
1377,000000,785,Who the fuck cares either way. Everybody involved in this looks ridiculous. https://t.co/B5TRG2c1tZ,I'm a doctor. For owls. Hoot hoot!,2017-03-30T14:47:44,,,847460337620103168,theowldoctor,2016-09-14T02:34:41,0,
1378,FFF04D,2293,They are trying to make this a feminist work issue. There is no reason for a man or a woman to be in a room alone d… https://t.co/aiEiANYJnd,"Looking to share and connect with the world. Christian. Conservative Independent. Living my Life Like Its Golden. I don't like haters, so if u r 1 stay away.",2017-03-30T14:47:44,"Houston, TX",,847460337347567616,Kimmy1Queen,2013-01-03T21:17:22,0,
1379,C0DEED,8230,"Mike Pence is so far in the closet, he can taste the mothballs. https://t.co/WURBKENBgi","Saving RWNJs from their manifold sins. Remember, I've seen you naked. BA, MS, BMF. Proudly blocked by @realjameswoods & @aigkenham #notmypresident",2017-03-30T14:47:45,"Heaven, USA",,847460341046886400,HunkyGayJesus,2012-10-20T17:06:28,0,
1380,F5F8FA,150,Liberal logic 🤔 https://t.co/GnXY3KAaWi,,2017-03-30T14:47:50,,,847460364778315777,LetsSeeLife,2016-09-25T02:52:31,0,
1381,0099B9,116,"Wonder how long it takes for Mike Pence to cum. I mean, it probably takes a good hour to get the priest in to supervise. Security and all...",I was once known as Parmesan Basil in certain places. I'm very interesting.,2017-03-30T14:47:50,"Des Moines, IA",,847460365600346113,LakdifFlanchzed,2009-03-05T14:45:46,0,
1382,000000,22107,"Mike Pence's refusal to be alone with women, writes emmaogreen, is a common practice among religious conservativeshttps://t.co/ivVKAEGfLz …","Get approved for a #Merchant #Cash #Advance in 2 hours. Even if you have bad #Credit, or have been denied by your #Bank. #BSAFunds",2017-03-30T14:47:53,,,847460377445175296,BSAFunds,2016-08-20T05:45:23,0,
1383,FFFFFF,905,"I understand what Mike Pence meant by not being with other women, because there was NO woman when he &amp; others passed laws on women's bodies.",Writer. Feminist. Atheist unwilling to change.,2017-03-30T14:47:53,"New York, USA",,847460377629573121,meherness,2009-07-18T04:40:53,0,
1384,C0DEED,343,Had a a feeling he was lame https://t.co/YbybTN0pXw,tcb Pacific U 2020,2017-03-30T14:47:58,W.E.B. DemBoyz,,847460399540617218,ctipzz,2012-02-11T02:03:06,0,
1385,1A1B1F,76,"@gringo_mzungu @sarahmccammon oh this is a Mike Pence story? Walsh was in my news feed, so I assumed him. That actually makes me happier.",Curious. Paradox.,2017-03-30T14:47:59,,,847460403231637505,malmondsmithers,2011-10-11T15:10:44,0,
1386,000000,364,SCREAMING https://t.co/SIgeboDymc,"Author of SHE CAME FROM BEYOND! (OCT 2015 THE OVERLOOK PRESS) http://amazon.com/She-Came-Beyon…
#THEWALKINGDEAD #TWDfamily",2017-03-30T14:47:59,,,847460403688943617,darling_nadine,2015-02-26T22:37:53,0,
1387,F0F0F0,1364,🙄 https://t.co/vP8D1Vt3mF,,2017-03-30T14:48:00,NYC,,847460404271783939,rossleonardy,2008-09-04T16:33:23,0,
1388,DED7D7,1981,Millennials don't engage in politics because what if Mike Pence was a decent husband AND climate change is a real thing.,"Pastor @bgcovenant | Author | ""Absurdist w/a surprisingly upbeat misanthropic twist."" - @calebjsaenz | Husband to Stef, Dad to Bella & Brixton",2017-03-30T14:48:01,"Bowling Green, OH",,847460411280576512,kyleburkholder,2009-07-17T18:27:24,0,
1389,C0DEED,309,The only things Mike Pence loves is money and dick,like its in a bio...,2017-03-30T14:48:02,"Greenville, MS",,847460414883606528,AlisonT57362005,2015-04-05T04:30:25,0,
1390,C0DEED,95,Mike Price is an honourable man but sordid gutter folks just cannot take it in. #depraved https://t.co/12aFiKjd5K,"Gospel preacher in  song,Staggie devotee, pleasure. boats. Fishes for souls and enthusiast for Freedom Alba",2017-03-30T14:48:05,Easter Ross,,847460425826316288,Munro1A3,2014-06-09T17:45:22,0,
1391,F5F8FA,5,"What's so weird about Mike Pence? I lived and ate only with a woman I called ""Mother"" for fifty years!",MAKE THE PINE BARRENS GREAT AGAIN,2017-03-30T14:48:10,"New Jersey, USA",,847460448991559682,WasteMgmtPlanet,2017-03-28T20:37:55,0,
1392,C0DEED,22760,#fakenews 👇🏻 https://t.co/kkX5gaRmh8,Tx female knows Donald Trump will Make America Great Again. Sick of PC - Take America back. RIGHT VS WRONG - learn it! I am on GAB.ai. same name @uthornsrawk,2017-03-30T14:48:12,,,847460458399358976,UTHornsRawk,2014-08-19T02:58:11,0,
1393,C0DEED,50401,copy that https://t.co/wPd4Zp18In,Publisher/Managing Editor at @PoliticusUSA. SAG/AFTRA “Scandalous trash” – Rick Perry campaign Header: Jim Lawrence,2017-03-30T14:48:12,"Pennsylvania, USA",,847460458244186112,PoliticusSarah,2009-08-05T03:00:35,0,
1394,000000,2832,"""Mike Pence"" there's this guy who's almost as godly as you his name is Justin Harris he's from Arkansas, look him up 😆","My opinions are my own. I'm liberal, progressive & democrat & want @BernieSanders out of my LIFE! #gunsense #NoDAPL",2017-03-30T14:48:16,The Other NY,,847460473490464769,celestepewter,2014-11-17T21:48:36,0,
1395,FFF04D,174,@KySportsRadio https://t.co/DkCxDaMzBB,"Dad, Grand-paw. Real Estate Appraiser of 33 years. UK Class of 1984. BBA. Runner. Take it easy now, that was a joke! Oops, husband! #BBN",2017-03-30T14:48:17,"London, KY",,847460476501938176,RobbyKnight,2009-05-03T14:11:08,0,
1396,1A1B1F,764,#TodayILearned Mike Pence is a terrible husband whose wife shouldn't trust him out of her sight.,"Editor-in-Chief, Pace and Space. Sweetheart to fantastic woman. Work is watching sports. Life is good.",2017-03-30T14:48:18,"Seattle, WA",,847460479928680448,RealFoxD,2009-08-27T07:23:33,0,
1397,99F0F0,545,No. Deal: you can stop citing the petty threat of rumors as reason to deprive women from having a seat at the table… https://t.co/LbSzCcgVNL,"5'3 with a bun & I curse like a sailor. Also, I don't take orders from Vladimir Putin.",2017-03-30T14:48:18,New York,,847460482692726784,anconl16,2011-05-10T14:00:30,0,
1398,C0DEED,32,"Yeah, like conservative Muslims https://t.co/ixy6hHt6xo","N'er do well philosopher (I tried to find other things to describe myself, but that really says it all - esp the philosopher part - and the n'er do well part)",2017-03-30T14:48:18,"North Carolina, USA",,847460483103772674,LewHassell,2013-09-23T14:28:46,0,
1399,F5F8FA,94,@sarahwhelmed Going to go out on a limb &amp; say Mike Pence is more popular/greater than u in every aspect of life 👍,Straight Rights Activist (SRA). Gun Lover. Pro Military! Supporter of American Citizens over Illegal Aliens. Proud Trump Voter 🇺🇸,2017-03-30T14:48:20,"St Louis, MO",,847460489047101442,MikeyTwoTimes1,2017-02-12T10:51:43,0,
1400,000000,177,"A story with more twists and turns than a slinky toy.  

https://t.co/RJMKNIyfVn","""She was warned. She was given an explanation. Nevertheless, she persisted."" Photographer; RT's and following are not necessarily an endorsement.",2017-03-30T14:48:20,,,847460490267697156,AnneWorner,2017-01-11T16:26:05,0,
1401,000000,351,"Thank you @VP for your role model of how a man should treat his wife. The liberals views aren't shocking anymore, i… https://t.co/KjcQ08qFtI",Author of Surrendered Identity,2017-03-30T14:48:22,United States,,847460496525606913,rrtheis81,2016-01-03T17:16:57,0,
1402,000000,49,*can't https://t.co/p5ok4MXkSy,You will create you're own perception of me and that's just fine. | 19,2017-03-30T14:48:23,High above the chimney tops,,847460502724841472,theokchronicles,2016-04-01T03:19:52,0,
1403,000000,3995,Jokes about Mike Pence's old-fashioned relationship with his wife will be even funnier once he's president.,Sr. Privacy/security reporter @vocativ. Email kcollier@vocativ.com. From West Virginia.,2017-03-30T14:48:24,NYC,,847460504838791168,kevincollier,2011-12-19T16:05:00,0,
1404,000000,5900,But no. Mike Pence has got to show the world what a pharasiacal sanctimonious self-righteous good little boy he is. That's his style.,"✟ Stayhome mom. GenX. Lawyer (JD Fordham BA Cornell). Ex-expat (French, Spanish, Italian) Just another shitpoaster for #WesternCivilization #Trump Writing book",2017-03-30T14:48:25,"North Carolina, USA",,847460509247057920,lorettatheprole,2014-09-11T13:59:12,0,
1405,000000,4122,"If you've seen emotional devastation of infidelity &amp; divorce up close, the Pences' decisions on protecting their bo… https://t.co/Mb92SezF23",Deputy Editorial Page Editor at USA TODAY. RTnot = :^) Email oped submissions to theforum@usatoday.com,2017-03-30T14:48:24,"Northern, Virginia",,847460507942400000,DavidMastio,2008-04-07T22:46:51,0,
1406,000000,320,"Conservatives have values. VP Mike Pence's respect for his wife is something that every man should learn.
#ThursdayThoughts",Millions of women voted for President Trump and are proud. A lot of people don't realize that. #WomenforTrump,2017-03-30T14:48:25,United States,,847460510928748545,_WomenforTrump_,2017-01-21T23:42:38,0,
1407,C0DEED,104,"Liberals make them selves look stupid every single day. Today it's the Mike Pence thing, about comments made in 2002. 😂😂😂",,2017-03-30T14:48:26,United States,,847460513868992517,phoov925,2011-05-24T02:42:57,0,
1408,ABACAD,186,"I think Mike Pence's rule is stupid as it applies in the abstract, but very smart as it applies to him, a high profile politician.",Citizen | Bi-Coastal Elite | Africanist | Sports Enthusiast | Truman National Security Fellow,2017-03-30T14:48:26,Washington DC,,847460514745602048,TheLifeofRifer,2011-01-29T01:03:08,0,
1409,000000,38,"Nobody is mocking Mike Pence for protecting his marriage, just for thinking that women are objects. https://t.co/oeDTQnUsga",Wubba lubba dub dub,2017-03-30T14:48:28,"Philadelphia, PA",,847460525290041347,realrebeccajo,2017-03-05T23:19:26,0,
1410,000000,3485,"It's intentional. Trump going down &amp; Pence either complicit or very, very, very, very, dumb.  #russiagate… https://t.co/VfhlD2l0Dy","""America doesn't know,"" DJT. JohnMiller does. My roots r Baghdad blonde #Chaldean #StillWithHer #russiagate #trumpleaks FollowTheRubles",2017-03-30T14:48:30,"Austin, TX",,847460530780385281,nahlaw,2010-05-17T16:38:00,0,
1411,617C87,250,Well that rules out the NY Times... https://t.co/NwuJOZrjN5,"Ex-New Yorker. Love 'Murica, IPAs, and family. Opinions my own; RT ≠ endorsement.",2017-03-30T14:48:30,"Richmond, VA",,847460530512052224,IrishBarrister,2011-02-02T22:57:16,0,
1412,C0DEED,176,#NeverAskAWoman if she wants to have dinner alone with Mike Pence,The funniest guy on the internet,2017-03-30T14:48:30,,,847460533901025284,Tuscon_Valdez,2015-05-03T13:35:24,0,
1413,C0DEED,453,Do I think this Mike Pence story is a non-story? Of course. But so is every conspiracy that Trump creates. Focus on the important stuff.,"On, Wisconsin. True Crime Freak. @CokeZero Addict. Complain less, you'll be happier. They call me Dad at the office.",2017-03-30T14:48:37,Chicago,,847460559645691906,wiscoinferno,2012-04-27T16:21:47,0,
1414,F5F8FA,940,"The left is concerned ""Mike Pence"" is honoring his wife, while they support Islam that treats women as property they treat as trash.","Saved by the grace of God. John 3:30 Praying for USA-return to Patriotism and Christian values. Trump supporter. Wife. Mother. SC girl, Sarcasm user. #MAGA",2017-03-30T14:48:37,Destination-Heaven,,847460562699079680,USA_First7,2016-10-19T13:54:12,0,
1415,FFF04D,2293,"And that in the end was the point. In a world of regular misunderstanding, common sense dictates avoiding circumsta… https://t.co/61LMWWJK83","Looking to share and connect with the world. Christian. Conservative Independent. Living my Life Like Its Golden. I don't like haters, so if u r 1 stay away.",2017-03-30T14:48:38,"Houston, TX",,847460564641079303,Kimmy1Queen,2013-01-03T21:17:22,0,
1416,4C9699,1723,"By American standards, arcane, no? how r they diff than many Muslims &amp; Orthodox Jews who hav similar rules separati… https://t.co/7mvvkajE03","Activist & Occasional Meddler. Tweets abt Italy & the Balkans, when not savaging current admin. Culture, Food, Origins. Curator & Oracle @silvanamondogallery",2017-03-30T14:48:40,"Colorado, USA",,847460571918336000,SilvanaMondo,2008-12-21T14:44:53,0,
1417,C0DEED,2539,When they trying to be savage about Mike Pence only dining alone with his wife but missing the opportunity to call… https://t.co/2wIT0BkOKv,"comedian, writer, storyteller, definitely not a doctor but I've had brain surgery...please give me attention (did I mention I've had brain surgery?)",2017-03-30T14:48:42,"Los Angeles, CA",,847460580092854273,LaurenBrownMD,2011-05-06T05:03:22,0,
1418,000000,281,@fieldyfieldy also dating mike pence?,"This is your world, you're the creator, find freedom in this canvas. Believe that you can do it, because you can do it",2017-03-30T14:48:44,United Kingdom,,847460590872166401,M0yku,2012-10-16T16:07:00,0,
1419,FBFCD8,1611,"Emma: How many layers of jumping 2 absurd conclusions r u on?

Her idiot followers: like 5 or 6 rn

Emma: u r like… https://t.co/783OZJ8BPt","they don't think it be like it is, but it do",2017-03-30T14:48:49,metro detroit,,847460609864093697,gr6z_,2012-11-22T17:41:00,0,
1420,C0DEED,189,"Women are scary siren temptresses, eh Mikey? https://t.co/LW2N9TkcAA",Chicago Expat/Bread Baker/Comic Reader/#Days Watcher/Boy Crazy/#imwithher,2017-03-30T14:48:50,,,847460615572590592,NotBoyfriends,2012-07-24T00:34:11,0,
1421,C0DEED,224,In all seriousness this is a interesting conversation started by the Mike Pence story. I disagree with Walsh/Pence https://t.co/FDzaO52ohZ,"Hey Twitter! I'm Reggie. I'm a Project Manager. I love sports, Clemson, Disney, movies, music, comics, country, running, tech, creative writing and the South!!",2017-03-30T14:48:51,not where I am where i'm going,,847460618969915393,ReggieCoachman,2008-11-13T02:00:16,0,
1422,C0DEED,86,"Some people think Pence is loyal to his wife, how about maybe his wife is so ""insecure"" that he won't let him be alone with any woman  #Mike",,2017-03-30T14:48:51,Texas Panhandle. ,,847460621947871233,solidad456,2014-12-21T01:54:17,0,
1423,ABB8C2,14888,LOL context and original sources... 🙄🙄🙄 https://t.co/3pONsGYoBS,"Live tweeting the REBIRTH of the Republic. Voice of My Generation.     

Western Chauvinism is not Racism

 #TipJar http://paypal.me/coondawg68",2017-03-30T14:48:53,The West is the Best,,847460628981702656,Coondawg68,2009-08-20T11:50:37,0,
1424,C0DEED,3421,"Don't Mock Mike Pence For Protecting His Marriage, Commend Him https://t.co/gIEA3tbvDh",Conservative Christian. Love my pets. Fighting for USA! Giving Trump a chance. #Trump #MAGA,2017-03-30T14:48:53,TX,,847460630118383619,dustymew,2009-05-22T22:35:07,0,
1425,FFFFFF,493,😦😦😦😦😦😦 https://t.co/Y5hninjMXM,"Account Manager @google. Bike-riding, doodling, exploring otherwise. Tweets in fits and starts but mostly retweets. I fall down Trumpholes here.",2017-03-30T14:48:54,"Ann Arbor, MI",,847460632228122626,PeterMBock,2010-07-14T05:03:18,0,
1426,642D8B,1094,"""Mike Pence"" is strange. No two ways about it. He respects his wife but has no respect for the rights of Women.… https://t.co/MLhlAO7qf1","Sexy, fashion , Diva..intellectual..smiley...Politically Progressive,not trying to sell you anything, but I love to shop..Love to laugh",2017-03-30T14:48:56,"Southfield, MI",,847460641203933184,PetiteCandy,2008-11-06T15:55:46,0,
1427,242423,10775,"In Honor of Liberal Lunacy on #conservative, not bitter #talkradio https://t.co/qiHobSPpzp
#RepealHB2
Senate Rules
Mike Pence
#ccot",Husband & Daddy | #Conservative #Christian | #TalkShow Host | #1A | #2A | #tcot | #ccot | #ProLife | #Homeschooling #Heritage #Sentinel | #Indiana | #TalkRadio,2017-03-30T14:48:58,"Indiana, USA",,847460651358277633,ToddHuffRadio,2011-11-06T05:06:26,0,
1428,C0DEED,586,"Mike Pence won't eat alone with a woman unless it's his wife, and ppl are mad at that because...?",SJU'20,2017-03-30T14:48:59, ♻️Town,,847460652272594944,thatguynate2,2015-04-27T04:34:24,0,
1429,0099B9,2566,Billy Graham did the same kind of thing. https://t.co/Bzbc15nnaE,#RefugeeResettlementWatch #tcot @RefugeeWatcher @ActForAmerica @jihadwatchRS @creepingsharia @marksteynonline @TheLastRefuge2 | Rush Limbaugh fan | ⚓️veteran ⚓️,2017-03-30T14:48:59,midwestern USA,,847460654499766274,ync1994,2009-03-11T22:07:17,0,
1430,C0DEED,989,#russiagate #Russia #RussiaInvestigation #TrumpTaxReturns https://t.co/aZtXkrhVZS,No taxes for Treason! #notaxes4treason  I am not a fan of🔥so if this offends don't follow me. No lists.,2017-03-30T14:48:59,"Minnesota, USA",,847460654290059264,HelenELais,2014-05-27T13:35:57,0,
1431,C0DEED,116,"Our @VP is a child that doesn't understand women have value outside of sex &amp; people defend him

@PeteDominick… https://t.co/hyTuIFGowv",A traveller from an antique land.,2017-03-30T14:49:02,,,847460664142696448,Billthemanhall,2012-02-29T01:26:07,0,
1432,9AE4E8,1008,Liberals stop being silly. Mike Pence can eat or not eat with whomever he chooses.,"I'm just a regular guy with varying interests, love fried foods, I'm politically moderate with left leanings. Go Broncos, SF Giants and Sixers.",2017-03-30T14:49:05,California,,847460679330050048,gatorboy,2009-05-08T05:05:46,0,
1433,C0DEED,3978,Exactly!!! Well said. https://t.co/NObEsSTXvw,Conservative Christian Wife and Mom UA Grad Roll Tide! 2A Military Wife Love West Point ; Pro Life!#Trump#BlueLivesMatter #AllLivesMatter No lists - block.,2017-03-30T14:49:06,"Louisiana, USA",,847460680747962368,tci92,2014-03-19T18:15:12,0,
1434,022330,285,"1. Not the most important takeaway here. 
2. Glad to see he takes his marriage seriously. https://t.co/fBhwDWsr3J",Just a guy with some thoughts. Many of them deep. Some of them shallow. Almost none of them 140 characters.,2017-03-30T14:49:06,,,847460680806481922,PhilWillSays,2014-02-03T01:38:29,0,
1435,F5F8FA,22,💀💀💀💀💀💀 https://t.co/m3nvvnTwdk,,2017-03-30T14:49:09,,,847460695465533442,IXXIXXXIXCV,2016-11-21T14:02:39,0,
1436,131516,1360,"MIKE PENSE GOES TO THE SALAD BAR
A One-Act Play
MIKE PENCE: [applying tongs condom to his tongs in case a woman is standing next to him]","100% official, unverified, progressive-minded blather with hints of music, games, and homoerotic cocktails.",2017-03-30T14:49:11,In your dreams.,,847460703367610368,thelancearthur,2010-05-13T20:52:47,0,
1437,C0DEED,8870,"To be fair, I don't know a lot of women who want to dine alone with Mike Pence.",All of these are jokes. None of this is about you.,2017-03-30T14:49:12,"Los Angeles, CA",,847460709457838081,TessRafferty,2011-04-02T00:32:11,0,
1438,EBEBEB,3139,"Mike Pence cant be around women alone, this is a problem.","Réveillé, avec goût cher | Woke with expensive taste 》Law Student 》》Human 》Mangénue 🔱 est Jän. 9. 98🌬",2017-03-30T14:49:13,Snapchat: delontedeclou,,847460710787366912,dilemmv,2013-07-11T21:05:03,0,
1439,000000,841,"Amen,Good Call. https://t.co/DSXb2JXoJZ","Christian, Conservative,Who Believes in Jesus Christ Gods' Only Begotten Son. STANDING 4 TRUTH and not Politically Correct..Truth sets us Free",2017-03-30T14:49:14,America Land Of The Free,,847460717523423237,judesnyder1,2011-10-30T16:12:22,0,
1440,352726,1454,"Don't dine w/ any politician unless my hand was on my$ “Mike Pence does not dine alone with women without his wife”

https://t.co/908vwES7y4",Check out my blog for more info and interesting stories: http://www.bstreetsmart.com/,2017-03-30T14:49:15,,,847460720597913600,TrueSelfDefense,2011-11-21T22:02:15,0,
1441,000000,6575,The Left makes issues about anything. Why does it matter if Mike Pence will only eat/attend events with his wife? https://t.co/1nFxXJsNqu,Daily Conservative op-eds on politics & philosophy from the brightest college students from all over the world.,2017-03-30T14:49:15,United States,,847460721604440065,RouserNews,2016-07-19T19:33:02,0,
1442,C0DEED,545,@blknetflix Mike Pence and 2nd lady after he confessed to passing Kellyanne Conway in a WH hallway without a male e… https://t.co/XSGJCza8a5,Let's discuss black films on Netflix & the politics of black representation in the media [no actual ties to Netflix],2017-03-30T14:49:16,Zamunda,,847460723752017921,blknetflix,2013-08-10T22:59:34,0,
1443,C0DEED,1879,Totally normal. https://t.co/gsU9ASUnHJ,"Kristin of House Hinze. First of my name, mother of Healys, fighter of cancer, defender of Bengals and Buckeye till I die! #WereStillHere #TheResistance",2017-03-30T14:49:17,"Worthington, OH",,847460729099661313,khealy13,2012-10-16T15:56:07,0,
1444,F5F8FA,790,"@JoshNoneYaBiz 

#YouMightBeASnowflake if you think Mike Pence being a good husband is worse than the Bill Clinton ORAL office❗","YUGE Trump supporter! #NRA #MAGA 
Christian friend of Bill W #LivingSober",2017-03-30T14:49:18,AZ,,847460734334255104,AZunderGOD,2017-02-09T11:27:07,0,
1445,F5F8FA,942,"@AppSame @realDonaldTrump  
Mike Pence vs Hillary Clinton
I will choose #MikePence all day everyday","WORK HARK, PLAY HARD #broadbandprivacy bill being lifted is complete BS, less government, not more.  D Brazile just blocked me cuz she is a clicker Nazi",2017-03-30T14:49:26,"Land of sunshine, FL",,847460766567383043,beninmaitland,2016-10-20T01:35:28,0,
1446,F0ECEB,13448,"Dear paparazzi, pls find pix of these asshole conservatives eating with women. https://t.co/gGVjDWYR7k","Actor (What To Expect..., Harold & Kumar, #WWKG (2017), @WeAreTheCircle), identity politics TIL I DIE",2017-03-30T14:49:28,"Douchetown, USA",,847460773509124096,AmirTalai,2009-03-27T07:46:48,0,
1447,000000,2319,#ThursdayThoughts https://t.co/7NvmxHFz1c,Digging for history - Garrett AT Pro,2017-03-30T14:49:29,The Left Coast,,847460778609328129,DigginDirty,2015-04-20T22:59:51,0,
1448,C0DEED,441,"I understand Mike Pence not wanting to appear inappropriate by dining alone with a woman who isn't his wife, but if it's BUSINESS, handle it","I love my Mopar, My Arizona Cardinals and Steelers. #NastyWoman and #SNL fan, Trial junkie and no I can't stand Drumpf.",2017-03-30T14:49:31,,,847460786322587648,GirlMopar,2014-03-17T05:31:49,0,
1449,000000,2400,@PrisonPlanet Maybe Mike Pence would like Christian women to start wearing veils.,The nightmare of the election is over. The tragedy of the aftermath has begun.,2017-03-30T14:49:31,The heart of fascism,,847460787027230722,Burger_Buzz,2013-03-21T22:26:32,0,
1450,C0DEED,770,the only thing that sounds worse than having dinner with mike pence is having dinner with mike &amp; his wife,"content strategist, @hugeinc // tina belcher in a fancy bathrobe",2017-03-30T14:49:32,"brooklyn, new york",,847460792005869569,stephmit,2009-06-15T01:12:30,0,
1451,C0DEED,1762,#TISNews Check https://t.co/4uKXVMWOIC to know why Mike Pence is trending at 9 in world at 30/03/2017 10:49:32 am,I Support Narendra Modi cuz hez the best PM India has ever had.People in billion dollar population who d'nt wnt progress are enemies'f Nation. Long Live Modi,2017-03-30T14:49:33,,,847460794862149635,INPrimeMinister,2013-02-22T15:56:34,0,
1452,000000,29,Are people seriously arguing over Mike Pence's eating habits? Pathetic.,Don't get mad at me. I'm just an egg.,2017-03-30T14:49:34,Twitter ,,847460800356921344,MylesKnowsMore,2014-05-14T00:28:50,0,
1453,C0DEED,18,@VeHasComeToo I mean it's not like this problem can be solved by staffing a single guy to work along Mike Pence.,Someone who tries to be funny but often gets  distracted by political commentary.,2017-03-30T14:49:38,,,847460814957236225,VeHasComeToo,2015-02-11T12:03:45,0,
1454,022330,5431,Mike Pence shouldn’t be able to have meals with any American. Doesn’t he want to fuck us all? #DidntWantToGoToChickFilAWithYouAnyway,"Writer, editor, Imposter Syndrome survivor. Former Head Writer @livewireradio. First book, Okay Fine Whatever, is due from Little, Brown in Feb 2018. #binder",2017-03-30T14:49:38,"portland, or",,847460817415020544,Wisenheimer,2008-05-11T19:46:33,0,
1455,000000,241,Finally something we agree on. https://t.co/No0qIbSoiJ,@2Dfaggot,2017-03-30T14:49:39,United States,,847460820745375744,9FLAVORS,2017-01-02T03:45:26,0,
1456,000000,2842,People should be taking tips from Mike Pence on how to make a marriage work &amp; withstand the stresses of public life,Villanova Alum | Conservative | Proud American | Romans 10:9 | RTs ≠ Endorsements,2017-03-30T14:49:42,Pennsylvania,,847460833101799424,msully_94,2009-05-19T02:10:36,0,
1457,C0DEED,1620,"https://t.co/IZ5R1vF0Ze Mike Penceِ
Matt Walshِ
Trump Remembers tِhe Ladiesِ
Donald Trump in Mar-a-Lagoِ
Collin Hartmanِ",https://t.co/3dXoEPWGrW Subscribe For The Latest Donald Trump News + Get Notifications When We Go Live! #trump #donaldtrump #MakeAmericaGreatAgain #Trump2016,2017-03-30T14:49:46,facebook.com/breakingbad263,,847460848733949952,BreakingBad263,2011-08-08T21:08:28,0,
1458,C0DEED,8219,"Like Mike Pence I don't dine alone with other women
I also don't flirt on or off line
I'm proud of my respect for my mate
Leftists can GFU",Professional Pilot  Constitution History Nature Firearms Science Documentaries Building an experimental aircraft Drink Bourbon neat Coffee black   Foul Language,2017-03-30T14:49:47,"Southeast, USA",,847460856082214915,JayStylus,2009-02-12T18:43:11,0,
