id,user_bg_color,user_followers,text,user_description,created,user_location,coordinates,id_str,user_name,user_created,retweet_count,geo
528,000000,254,"Liberals hate happy people because their life is a failure  ""Mike Pence""",,2017-03-30T14:28:57,"Florida, USA",,847455611033800706,Elcillene,2016-06-14T01:19:49,0,
529,C0DEED,163,"Mike Pence also refuses to dine with Warren Beatty 

https://t.co/zgaeJaWBDO",don't need no credit card to ride this train,2017-03-30T14:29:01,ATX ,,847455627119017984,thepwrofluv,2012-06-12T06:57:21,0,
530,1A1B1F,1078,"well, mostly, because I'm a fuckin adult and I'm busy doing adult shit most of the time. If Mike Pence is so weirded out being alone with ..",I do servers and chicks with great butts.    what do your fingers smell like? Maybe I punched a nazi?,2017-03-30T14:29:04,I MEK JOHK,,847455642172375040,coconono,2009-05-12T12:23:51,0,
531,1B0A16,240,"Ayatollah Mike Pence @mike_pence @VP is also designing a Christian burqa

https://t.co/piJzdnw1gb

#Pence #fakeChristian",Organisational change and internal communications consultant,2017-03-30T14:29:05,,,847455644751941632,inside_work,2010-06-04T08:51:38,0,
532,C0DEED,322,Mike Pence Shenanigans #NewPresidentialExpenses https://t.co/IWy3SYSkpr,I feel like a monster chasing cookies.,2017-03-30T14:29:06,Sesame Street,,847455648199593984,coolcam101,2014-10-20T17:37:22,0,
533,F5F8FA,1005,Oh hell https://t.co/FWn4MA7hY9,"NO lists, I will block. No racist BS. Love Humor. Despises

 liars, did your God put up walls? Just 45?",2017-03-30T14:29:09,,,847455660858126336,uresa54,2016-01-23T17:09:55,0,
534,000000,27693,"#Liberals mocking Mike Pence/Matt Walsh 4 listening 2 their wives &amp; respecting their concerns/needs...
#Projecting… https://t.co/KRiRL0epN9","Political, Sports & Wall Street Punditry/ Writer-Analyst-Storyteller-Businessman/ #MAGA #VETS #Capitalist #Nationalist #1A #2A  Smarts & Swagger™ Podcast",2017-03-30T14:29:09,United States,,847455660698619904,thetoddwhaines,2012-03-30T11:36:55,0,
535,FFE8CD,51,Mike Pence has to have his wife in the room when he electroshocks lesbians.,soupless bitch,2017-03-30T14:29:09,,,847455661768138756,maybetravis,2010-06-12T09:07:07,0,
536,000000,2068,"This whole thing is just really, really sad. Aren't people lonely enough, without doing this to themselves.

https://t.co/HdhKQ0tj8u","What better place than here.
                                             
What better time than now.",2017-03-30T14:29:10,,,847455667019407362,mhoye,2008-09-12T16:23:35,0,
537,C0DEED,4091,I'm asking very seriously: Why do people care what Mike Pence calls his wife?,"b/c of the relationships, PR, cause marketing, writing, sales, the ask.. I tweet about it all- w/ a Jewish slant. Luv New London CT, Boston, Cle OH, Jax FL & TO",2017-03-30T14:29:17,Israel,,847455695356153857,fundraisinisfun,2011-01-27T15:30:25,0,
538,022330,10167,"Yeah, where are the features?

https://t.co/fLaL1JjRmJ

https://t.co/THl70NKwbW

https://t.co/SS1sxulD63… https://t.co/ke1YXd9mcH",''This guy Ben''-- Megyn Kelly Ben.Terris@washpost.com and/or 202-334-9418,2017-03-30T14:29:18,"Washington, D.C",,847455699038650368,bterris,2008-11-12T15:09:54,0,
539,022330,9354,mike pence loves eating hot dogs like this when alone with his wife but feels guilty afterwards. https://t.co/x9nKmolNWg,"i don't look familiar. you just think all black people look alike. 
(jusssstttt kiddingggggg!) IG: @delon03",2017-03-30T14:29:24,"Los Angeles, CA",,847455723906670592,delon03,2010-02-22T00:34:33,0,
540,C0DEED,668,I'm not going to email Mike Pence's wife,Manic Pixie Garbage Idiot,2017-03-30T14:29:27,"Pittsburgh, PA",,847455736405704705,ClaytonDeth,2011-03-21T15:45:08,0,
541,000000,678,And now we know why right wing trolls love calling people 'cuck'. https://t.co/lijHkNsi2H,Retired Taxi Driver - Commercial Real Estate Agent - House Music Junkie - Infosec Noob - Old hack learning new tricks. - Happy to punch a nazi anytime.,2017-03-30T14:29:27,"San Francisco, CA",,847455736246312960,mrjhnsn,2009-03-02T01:53:03,0,
542,000000,117,"""Mike Pence"" @VP #Trumprussia #TREASON https://t.co/GpN6rDscE0",#Trumprussia #TREASON #Focus #TrumpLies #TrumpTaxesMarch #TrumpTaxes Trump Supporters Will Be Blocked Cuz I Can :),2017-03-30T14:29:28,"Washington, USA",,847455741610909696,Kare_P,2009-04-26T13:10:40,0,
543,000000,31,How Mike Pence’s Marriage Became Fodder for the Culture Wars https://t.co/EYF7kdnCRZ,Sharing from top viral sites on the web and posting every single minute like a wild fire! #TopNews #ViralStories #ViralVideos #ViralMemes #Infotainment,2017-03-30T14:29:29,,,847455745545129985,viralbot360,2016-11-01T02:51:06,0,
544,C0DEED,7021,Mike Pence ? https://t.co/5VRuApgTU8,,2017-03-30T14:29:30,,,847455750813175808,xdelmar59,2014-07-24T16:45:11,0,
545,F5F8FA,70,wish i had a gf like mike pence's https://t.co/7WdU4ZW7vd,registered flex offender // Jak II is the greatest game of all time // @katienotopoulos is my buzzfeed wife,2017-03-30T14:29:31,"Pak Bong, Thailand",,847455755997388801,poondude,2016-09-14T03:41:37,0,
546,F5F8FA,1001,"Wow, poor liberals....
When all you have left is attacking Mike Pence for having good morals you know it's therapy time.",#Christian #Cherokee #Texas #WomenForTrump husband @tunnelratranger Support: #Constitution #RuleofLaw #LEO #Police #Military #Veterans #CosProject #StopIslam,2017-03-30T14:29:35,,,847455771931561984,realKathlena,2016-08-31T19:32:28,0,
547,000000,1666,"No, what Mike Pence does, is respects his wife an wants her to know he's not diddling his hot secretary.",I listen to Heavy Metal and play video games. Apparently I'm also dead. Katsuragi is my Spirit Animal. My preferred pronoun is Thor. God of Thunder.,2017-03-30T14:29:38,Canada,,847455784963252224,KevinDahmer,2011-06-18T12:09:37,0,
548,F5F8FA,210,"#LibLogic, I put something in quotes, clearly about mike pence, then feign surprise when people call me on my hyper… https://t.co/OEmOVATpCt","I've got a lot of problems with you people, and now you're going to hear about it!",2017-03-30T14:29:38,Kingdom of Saudi Arabia,,847455784103329793,Science_Reigns,2016-04-26T19:37:42,0,
549,C0DEED,127,@mjblair I do NOT want to be anywhere near Mike Pence's bedroom.  Yikes.,,2017-03-30T14:29:40,Minnesota,,847455791195893760,HoopsMavenHM,2011-05-27T19:40:50,0,
550,845667,23,nice to know so many liberal women won't mind if their man takes me out to dinner tonight. and we down some shots. / mike pence,Hitchcock Blonde,2017-03-30T14:29:43,,,847455805372641281,OmneityEnigma,2015-08-08T01:11:27,0,
551,C0DEED,322,"Mike Pence Foundation 
#NewPresidentialExpenses https://t.co/0v2hfoUsb8",I feel like a monster chasing cookies.,2017-03-30T14:29:46,Sesame Street,,847455817129271298,coolcam101,2014-10-20T17:37:22,0,
552,C0DEED,4402,"Mike Pence's refusal to be alone with women, is a standard practice among religious conservatives: https://t.co/BeJRQ8QWmE","Global Macro Focused Equity/Equity Index Trader; cross asset experience in EM+Developed Markets;straight shooter, citizen of the world.",2017-03-30T14:29:49,New York City,,847455831662645248,GlobalMacroZen,2009-10-01T18:10:23,0,
553,C0DEED,102,So you're telling me that I've had to tolerate this crap for a decade and Mike Pence things I'M going to be the pro… https://t.co/ARYXMURBGH,"I write stuff over at http://harmonopoly.tumblr.com . And here too, I guess.",2017-03-30T14:29:50,"Columbus, OH",,847455833562722304,harmonopoly,2013-09-20T01:11:21,0,
554,709397,15,Yup. Same type. https://t.co/lMrAbOtmGj,"practicing everyday, but sometimes you can't tell",2017-03-30T14:29:51,East of Eden/South of Paradise,,847455839807877121,jjphillip,2011-06-13T15:26:43,0,
555,C0DEED,314,Mike Pence- Women do have brains.We are the breadwinners in many homes.So you only see us as sexual objects.We bring no other value. Ugh!!!!,mother of 3 boys. Ohio State Alumni. Go Bucks! #StillWithHer,2017-03-30T14:29:53,,,847455845189206017,Esz1257,2009-08-16T00:09:52,0,
556,000000,8264,"""Mike Pence"" if u hate him for simply being faithful to his spouse you heart is likely dark and your soul needs repair  Evil Hates Light",Team following all the best metro Atlanta tweeters! Tweet to us and let us know you about you. We flush our tweets daily so get em now. RT's not endorsements,2017-03-30T14:29:55,"Atlanta, GA",,847455856719347712,atlantatweeps,2009-03-23T03:58:10,0,
557,000000,3971,"this liberal so-called ""journalist"" just attacked VP Mike Pence for his sincere Christian Values! It's SO SAD! https://t.co/BhMb9aJdib",happily married2my #soulmate #IfIDontFollowTweetMe #MyPresidentTrump  #BanSoros #GodGunCountry #AuditTheFed  #BuyIvanka #MAGA #IStandWithIsreal,2017-03-30T14:29:57, Florida,,847455864931852288,LauraLeeBordas,2013-03-10T11:18:51,0,
558,000000,1393,"I don't care who ""Mike Pence"" eats with. I do care that he tried to pass a law requiring women to hold funerals for aborted/miscarried fetus","I write horror and fantasy.  I love books, movies, music and history.  I love my wife and kids even more.",2017-03-30T14:29:58,,,847455869558116354,CoastalRoadNine,2015-04-24T13:29:47,0,
559,022330,1888,"While I respect @VP's commitment to fidelity, not dining alone with other women is outrageous and another sturdy ti… https://t.co/C5dsEil1dT","UWS guy. COO FlyCleaners Past: @TNR, Harvard MBA, Bain Consulting, @NYCEDC. Opinions on: dry cleaning & laundry, politics, biz, serial TV shows",2017-03-30T14:30:00,New York City,,847455874327220224,eddlest,2009-05-18T02:15:57,0,
560,000000,940,Can we please let the mike pence thing die after one day?,Because vlogging deserves a better class of Catholic.,2017-03-30T14:30:00,The Kingdom of God,,847455876092796928,SteveMissionary,2014-07-23T21:23:20,0,
561,A0C4C0,36154,"mike pence says he won't dine with any woman who isn't his wife.

is it possible that there are no other women who want to dine with him?","stand-up comedian, twitter user, bio writer, netflix special haver: http://t.co/XUDt1KrgUF, and itunes album downloadee: https://t.co/HpuQ5ozt73",2017-03-30T14:30:00,"think globally, act jokily",,847455876302622720,myqkaplan,2009-06-09T20:02:30,0,
562,C0DEED,688,Mike Pence stuff doesn't seem too weird to me. I can't imagine my 58 year old Dad going out to dinner with just a woman friend.,,2017-03-30T14:30:01,440,,847455879263789058,Scd_1216,2010-03-12T00:26:41,0,
563,F5F8FA,365,"Top 5:
1: Marc-Yvan Côté
2: #ThursdayThoughts
3: #FraudAThon
4: Mike Pence +7
5: Alexandre Bissonnette +6","Today’s Top 5 Twitter Trends & Trending Now in your city, country or worldwide",2017-03-30T14:30:02,Canada,,847455884460539904,Trends5Canada,2016-12-09T19:06:23,0,
564,F5F8FA,517,"Top 5:
1: #ThursdayThoughts
2: #NationalDoctorsDay +1
3: #NeverAskAWoman -1
4: Mike Pence +7
5: #RepealHB2 -1","Today’s Top 5 Trends & Trending Now in your city, country or worldwide",2017-03-30T14:30:03,The Good Ole' U.S. of A.,,847455886817714179,Trends5USA,2016-12-09T04:26:39,0,
565,000000,223,"Mike Pence https://t.co/g9x4TBUMyE The Washington Post ran a profile of Karen Pence, the wife of Vice President ... #NewPresidentialExpenses","Your daily dose of trends and news on the Internet. Real-time, neutral, diverse!",2017-03-30T14:30:02,,,847455886616346624,TriendBot,2016-05-07T03:31:25,0,
566,000000,249,VP Mike Pence Participates in a Swearing in Ceremony for the US Ambassador to Israel David Friedman. March 29 2017. https://t.co/DzvcCuvkmU,The programmer. My interests Physics. The innovation. Art. I've been doing Internet business.  #followback #,2017-03-30T14:30:03,"Washington, USA",,847455887950098432,SergeyT9384,2014-11-24T16:02:00,0,
567,022330,18,I liked a @YouTube video https://t.co/swzGvPMnhl Bill O'Reilly On Mike Pence: Defending Trump Is Not Easy,Full time student,2017-03-30T14:30:06,"Atlanta, Georgia",,847455901124444160,Robin39999,2013-07-24T22:04:59,0,
568,1A1B1F,4718,"mike pence, sawing off a chunk of his massively well done steak, is about to take a bite when he spies a vagina-haver --- and freezes","Do you not know, my son, with how little wisdom the world is governed?",2017-03-30T14:30:06,"Austin, TX",,847455903163056128,robertjbennett,2009-03-29T18:46:42,0,
569,022330,570,STOP MAKING FUN OF MIKE PENCE YOU UNCIVILIZED BASTARDS!! https://t.co/APchz30nWT,Co-host: @politicspodcast. I do most of the yelling: https://soundcloud.com/its-always-poltical #BanMemes,2017-03-30T14:30:07,itunes,,847455906115731462,MuchoMacho,2011-01-02T23:18:33,0,
570,C0DEED,349,I LOVE HIS MAN https://t.co/NdOmJNpEmQ,,2017-03-30T14:30:08,"Washington, DC",,847455909496344576,dvalzDC,2014-09-16T01:27:21,0,
571,F5F8FA,17,"Mike Pence appears to be the ""Donald Trump transition team"" member caught on wiretap https://t.co/KlPLbXVzwS via @PalmerReport",Ru free,2017-03-30T14:30:10,"Freedom, CA",,847455916349837312,Rufree13,2016-10-02T18:47:57,0,
572,000000,1158,How Mike Pence’s Marriage Became Fodder for the Culture Wars https://t.co/m1HXooNyLW,USA news,2017-03-30T14:30:14,Canada,,847455936839008256,TheUSAbulletin,2016-06-25T00:30:09,0,
573,C0DEED,606,"Look, I don't like Mike Pence either.
But I've seen so many het monogamous people who flip out when their partner has an opposite-sex friend","Spec fic writer, poet, Aspie. Social justice bard. She/her",2017-03-30T14:30:18,Canada,,847455951091191808,xasymptote,2009-12-19T19:43:39,0,
574,F5F8FA,11,"falls house maid  from the seventh floor in KEWAIT city  but has not died
show in youtube
https://t.co/9dIbCb65AU
 ""Mike Pence""",,2017-03-30T14:30:19,,,847455954840965120,multi88videos,2016-12-11T11:46:22,0,
575,C0DEED,1167,I've already explained it to you alt right... Are you stuck on stupid? https://t.co/074OaZ4wVO,"#Persist
#Resist
#Exist

#VetsAgainstTrump

#TheResistance",2017-03-30T14:30:20,,,847455959299641345,garageleague66,2014-02-19T18:34:29,0,
576,F5F8FA,699,@lilyallen Mike Pence would *not* approve.,World's butchest non-transitioned hetero transwoman. He/him. Unsettling ideas.,2017-03-30T14:30:22,,,847455966933114882,KatanaOfLogic,2016-09-30T22:56:56,0,
577,12206E,729,"I just don't care full stop. 
Pence helping stop Dems from taking money from my kids so another woman can murder he… https://t.co/qV81z0XKyX","Mommy, Catholic Separatist, herder of goats, wife, baker of delicious things, @Shepherdess on Gab.ai",2017-03-30T14:30:23,,,847455972800872450,MollyMiller951,2009-08-02T22:30:10,0,
578,A5CBDE,368,If youre someone who wants Mike Pence to stay outta same sex relationships than treat him how you want to be treated &amp; stay outta his,"Your best friends favorite recap writer & Poet Laureate @FearTheSword 
Ramblers/Cavs/Browns/Tribe/Illini/CFC
Jesuit Educated AMDG",2017-03-30T14:30:23,"The Mitten, MI",,847455974663127043,AIRalston,2009-12-16T14:16:13,0,
579,F5F8FA,943,CIA does not know what to do since Mike Pence is too moral &amp; righteous to become tainted by their usual 'supply hooker &amp; blackmail'  scheme,"WORK HARK, PLAY HARD #broadbandprivacy bill being lifted is complete BS, less government, not more.  D Brazile just blocked me cuz she is a clicker Nazi",2017-03-30T14:30:24,"Land of sunshine, FL",,847455978702458880,beninmaitland,2016-10-20T01:35:28,0,
580,022330,301,The same people ridiculing Mike Pence for protecting his marriage would skewer him if they saw him eating with a woman who wasn't his wife.,"I try to love God and love people.  If I do those well, I find that everything else just kind of falls into place.",2017-03-30T14:30:25,,,847455980296085505,ScoobyCheese,2009-04-09T21:55:18,0,
581,C0DEED,3166,Weird. Mike Pence's wife had no problem getting beers and tacos alone with me last week...,Executive Producer of Dawn of the Croods (NOW ON NETFLIX!) & writer of stuff like Robot Chicken & the comic book Rascal Raccoon's Raging Revenge from Oni Press.,2017-03-30T14:30:28,"Los Angeles, CA",,847455993403330561,B_Hay,2010-01-04T22:54:12,0,
582,C0DEED,210,"@mkhammer @MZHemingway Totally agree.  And, what's important, it works for them.  Mike Pence is not known for his personal scandals.","Constitutional Conservative; retired teacher; love teaching children, not teaching to tests",2017-03-30T14:30:29,"Round Lake, NY",,847455998470209536,SandyJeanne,2011-05-17T18:31:50,0,
583,C0DEED,112,Pfft...so Mike Pence won't dine alone with any woman but his wife...Who GAF...Mike Pence does not believe in evolution!..there's the story.,Universally Ambiguous,2017-03-30T14:30:31,,,847456005852061698,Diibs9,2011-09-13T05:06:16,0,
584,F5F8FA,234,"@realDonaldTrump Trump should follow that advice⚡️ “Mike Pence does not dine alone with women without his wife”

https://t.co/97d6uzfgbB","Proud American , WomenRights, GayRights , HumanRights, EnvironmentalRights, ReligiousRights, ImmigrationRights MedicalRights and happiness for all Americans",2017-03-30T14:30:38,United States,,847456036126646272,make_fair,2016-10-13T15:32:45,0,
585,FFF04D,2294,People who are outraged or confused about @VP Mike Pence's relationship with his wife are people that don't understand common decency.,"Looking to share and connect with the world. Christian. Conservative Independent. Living my Life Like Its Golden. I don't like haters, so if u r 1 stay away.",2017-03-30T14:30:38,"Houston, TX",,847456035941920768,Kimmy1Queen,2013-01-03T21:17:22,0,
586,B2DFDA,86,"Well, this is insane. https://t.co/PWc3KvnU42","Focused on the future of journalism. | @Vassar '11, @MedillSchool, formerly tech x design @McMasterCarr | CT x CHI",2017-03-30T14:30:39,,,847456038982828032,karavoght,2011-02-09T02:29:06,0,
587,EDECE9,2652,@iLoveTheBrowns3 is this It? Bc I'm having a real hard time trying to figure out this nutty shit. ALL spouses should be like Mike Pence,"Conservative/libertarian leaning. Jesus, Constitution & Freedom Loving News Junkie. Wife & mom. Despise PC. People have got to lighten up. #CruzCrew",2017-03-30T14:30:39,,,847456041197420544,anotherday1,2009-03-17T11:27:32,0,
588,000000,11190,"Who is also vying to replace Trump as emperor. These are evil Nazis, folks. He's #Complicit and an illicit hypocrit… https://t.co/xRIqGcZKNE","#Anonymous #Alien #Comic #Trance #DJ
#Filmmaker #Writer #Followback #TheResistance   #Colony #ColonyUSA",2017-03-30T14:30:40,United States,,847456042279591940,JamesEFinch,2010-11-16T15:42:35,0,
589,F5F8FA,10,Congrats to Mike Pence @VP for being the first openly gay vice president!,EM A BINNY,2017-03-30T14:30:40,MONNEY APOOLLOS,,847456043617574913,DankyMcMemerey,2017-01-15T19:43:33,0,
590,C0DEED,1850,You blaspheme Dharma. Delete your account. https://t.co/bJa6D9uqxD,CEO; Small government fiscal and constitutional conservative. Sworn enemy of moral hazard. Proud to be followed by @SenTedCruz. Will follow (and unfollow) back.,2017-03-30T14:30:40,Republic of Texas,,847456044850716672,DiscardedVirtue,2012-06-16T16:05:32,0,
591,C0DEED,494,It is sad that this is considered news. @jason_howerton this isn't a crack at you or the publication. Just in gener… https://t.co/EFqXlFledh,#22kill getting hig by semi hurts.,2017-03-30T14:30:41,,,847456047409225731,snyder13f,2014-04-22T17:04:46,0,
592,022330,172,Sounds close to another group of men from a different part of the world.... https://t.co/fYFwUMO03V,Man of 1000 interests but few career opportunities. Avatar credits to grandma boots' plate painting. I also have a great wife @kara_lozano,2017-03-30T14:30:44,Indianapolis ,,847456061493727232,caleb_lozano,2011-11-18T21:30:28,0,
593,000000,661,This!!👏👏👏👏👏👏💯💯💯💯 https://t.co/eLCEa5fIWg,"#NeverTrump #NeverHillary 
Female Reagan Conservative, with a J.D. KSR &  my UK Wildcats.  My motto: Don't want your feelings hurt; don't lose! #BBN",2017-03-30T14:30:47,"B*Ville, Kentucky",,847456073363488769,IMissRWReagan,2009-02-28T23:51:58,0,
594,FFF04D,7994,"I've thought Mike Pence was weird for years. Guys, he signed a law making it ok for restaurants not to serve gays.… https://t.co/IOeHs4PPC0","I'm a political junkie and junk food junkie. Don't tell me, ""Both sides do it."" If I'm not in NYC, you'll probably find me poolside on a cruise ship.",2017-03-30T14:30:51,"New York, NY",,847456089683525634,RussOnPolitics,2010-02-01T17:03:08,0,
595,C0DEED,16347,"Mike Pence: ""I try to avoid the appearance of impropriety by not dining alone w/ other women""

Twitter: ""So you're like a rapey Jihadist?""",This account is ONE HUNDRED PERCENT pro-Jihad *ululates wildly* I shall bathe in infidel blood,2017-03-30T14:30:52,,,847456093164974080,wokieleaks1,2014-08-30T04:32:31,0,
596,0F040F,272,"""Mike Pence""",just a jokester thinkin' out loud. I talk about politics here and there. 🤠,2017-03-30T14:30:53,"Seattle, WA",,847456096633606144,happypandabearr,2011-03-17T21:17:45,0,
597,000000,14,It's not standard practice. It's the thing that governs all conservatives: FEAR. https://t.co/RGjgJIckQD,Pacifist Anarchist in the making. Street Artist. Feminist Ally. #DisarmtheWorld #NoMilitaryPolice #EducationFirstIncarcerationLast #OHMYScience #theUniverse,2017-03-30T14:30:55,United States,,847456105735245824,AnarchynAmerica,2017-02-05T02:32:05,0,
598,C0DEED,22025,The Insane Response to Mike Pence’s Fidelity Summed Up In One Tweet https://t.co/NVh2ETx8JO,Trump/Pence Save USA: #MAGA; Defeat ISIS; Stop Socialism/Leftism; Sovereignty; Strong Military; Constitutionalist; #2A; Law & Order; Jesus; Home of the Brave,2017-03-30T14:30:57,"Conservativeland, Orange Co CA",,847456114488754176,JoeFreedomLove,2014-08-15T20:59:39,0,
599,C0DEED,349,I LOVE THIS MAN https://t.co/NdOmJNpEmQ,,2017-03-30T14:30:58,"Washington, DC",,847456117626032130,dvalzDC,2014-09-16T01:27:21,0,
600,9AE4E8,946,Hear me out before judging: have we considered using Mike Pence's raw sexual chemistry as an aid for lesbian conversion therapy?,"Food, politics & sports. A friendly crank. Practitioner of drunken bonhomie. Can be obnoxiously funny in a juvenile way. Avid Jayhawk lover. Opinions my own.",2017-03-30T14:31:02,"Overland Park, KS",,847456135439204353,gavinesq,2008-10-29T21:36:44,0,
601,642D8B,1665,Homophobic VP Pence should recuse himself from office because of his prejudices against Americans who happen to be… https://t.co/1rIttz00eO,I have lost faith in polling and cable news shows. NO DIRECT MESSAGES PLEASE,2017-03-30T14:31:03,"Chicago, IL",,847456140988305409,crlbe,2011-04-02T03:18:38,0,
602,131516,410747,"According to a WP interview with Karen, Mike Pence never dines or drinks without her by his side.

The internet has… https://t.co/9P8i12dWob",News for the new America.,2017-03-30T14:31:04,,,847456145845264384,Fusion,2010-03-10T17:48:51,0,
603,000000,470,Such a shame to Mike Pence under attack by liberals! It's like they just pick a new target each week and hope something sticks. Pathetic!,"This country was founded for the American people, by the American people... and it's made up of the American people!",2017-03-30T14:31:05,The United States of America,,847456148340981761,Americais4us,2017-01-29T16:57:18,0,
604,F5F8FA,90,https://t.co/2dlrBYn9R8,Born and raised in East Hampton.  Grew up downstreet under the North Main Street bridge.,2017-03-30T14:31:05,"East Hampton, NY",,847456150681296901,downstreeter1,2016-07-21T15:41:11,0,
605,F5F8FA,1121,How Mike Pence’s Marriage Became Fodder for the Culture Wars https://t.co/nD2XQhfeEy,LGBT news,2017-03-30T14:31:07,Canada,,847456156968665092,LGBTbulletin,2016-06-30T10:19:43,0,
606,9E209E,1425,"If alone-w-a woman maybe he can't behave like he'd just grab her pussy,45 does.Alcohol could mean he loses control&amp;… https://t.co/jvFVrCyFBr","A Mom,Jay McGuiness🍻,TW💞,#TWFanmily 🌺,& bookworm 📚 #TheResistance",2017-03-30T14:31:08,Minnesota,,847456162807021569,kasy68,2009-02-26T21:16:02,0,
607,000000,11,"""Mike Pence""  FIRST THING THAT COMES TO MIND NOWADAYS........ https://t.co/eyjvYyfaBo","Opposing, often less popular argument among targeted audiences.",2017-03-30T14:31:10,Worldwide,,847456169455108100,TheeAdvocatus1,2017-01-16T16:12:09,0,
608,F5F8FA,6,"Trump had to tweet this because Mike Pence is not allowed to use the word ""caucus"" if women might see it. https://t.co/8aqIVWl2XS via behi…",,2017-03-30T14:31:10,,,847456171388657668,fjh235,2017-03-10T14:21:19,0,
609,000000,1021,Mike Pence is definitely hiding something https://t.co/tTRdxc1miu,For the oppressed & disenfranchised. | Shop: http://americahates.us/shop/ | IG: americahatesus | Attorney.  Brooklyn. |  This is a new account.  Follow!,2017-03-30T14:31:13,"Brooklyn, NY",,847456180519567362,AmericaHatesUs,2016-03-18T02:14:40,0,
610,000000,43,i can't believe dumbfuck mike pence and dumbfuck opionion havers re mike pence are what everyone's mad at today. jesus christ.,Information Retainer,2017-03-30T14:31:14,"Chicago, IL",,847456188073558016,StayingOnBrand,2016-04-20T14:37:45,0,
611,000000,41,As we make fun of Mike Pence today I would like to remind you he is currently the most likely person to be the 46th president of the U.S,"cys-er, hetromantic, consumes too much media and trys to know what he's talking about.  Now writing for @infiniterainday!",2017-03-30T14:31:15,"Salt Lake City, UT",,847456189319217154,loamlife,2014-09-17T00:26:40,0,
612,EDE4E4,23535,"Wow @nytimes &amp; @washingtonpost you outdid yourselves hiring this gem! A man that honors his wife is bad, got it! https://t.co/zQnVTzAyCJ",Org of Conservative Americans: @realDonaldTrump @Potus #BlueLivesMatter #BuildTheWall  #NotTheEnemy #Deplorable #DrainTheSwamp #WeStandWithIsrael 🇺🇸❤️🇮🇱,2017-03-30T14:31:15,"Washington, D.C. & TEXAS!",,847456189801668613,OCAmericans,2009-01-09T18:45:58,0,
613,510800,592,As detestable as Mike Pence is I will take him over #45. At least he doesn't act like a moron in public &amp;we might not go to war over a tweet,#MakeTrumpNameShit  #KillTrumpBrand #BankruptTrump #BoycottTrumpBusiness Our lives begin to end the day we become silent about things that matter ~ MLK,2017-03-30T14:31:18,,,847456204582305792,ashleyb8255,2009-02-28T17:36:18,0,
