id,user_bg_color,user_followers,text,user_description,created,user_location,coordinates,id_str,user_name,user_created,retweet_count,geo
261,F5F8FA,741,St Petersburg metro bomb victims identified  https://t.co/JaVMDObGj1,Unbiased independent World news & Best Trending Product Reviews & Prices,2017-04-04T19:30:37,United Kingdom,,849343466714935296,TOUCHSTONE___,2017-01-23T14:28:28,0,
262,F5F8FA,221,Blast on the St. Petersburg subway - VOA TV Ashna https://t.co/EK6QiBMQPk &gt;Blast on the St. Petersburg subway - VOA… https://t.co/Q5QsnmODLR,,2017-04-04T19:30:37,Afghanistan,,849343466236768258,NewsUpdatesAf,2016-09-30T12:55:25,0,
263,C0DEED,2183,St Petersburg metro bomb victims identified https://t.co/Azm8IYyRgh #BBC,♛,2017-04-04T19:30:37,cryptowatchbot@gmail.com,,849343469021802497,RealTimeHack,2011-04-08T16:34:51,0,
264,000000,91759,St Petersburg metro bomb victims identified https://t.co/5hbMcI1TJl https://t.co/fOmAnAPeTO,"World News, MMA News, Sports, Entertainment News and More",2017-04-04T19:30:37,"Australia, USA, World",,849343468656832514,realnewsco,2015-08-14T08:47:47,0,
265,000000,80,@Escasi99 *explosion mental* https://t.co/R1N56gZrRv,"soy muy timida,fujoshi,amante de BTS,me encantan los gatos,soy otaku full,me gusta leer,soy chilena,me gusta escribir,soy muy loca,amo la musica amo el yoonmin",2017-04-04T19:30:39,Chile,,849343474818306050,SugaritaEver,2015-05-01T03:36:36,0,
266,F5F8FA,4,"«I stuck around St. Petersburg when I saw it was a time for a change, killed the czar and his ministers, Anastasia… https://t.co/5BDijryLxp",Partito nazional- patriottico dei popoli padani. Fascisti padani. Per la repubblica sociale padana. Jedem das Seine!,2017-04-04T19:30:41,,,849343483274039296,DURI_AI_BANCHI,2016-09-06T16:46:43,0,
267,C0DEED,1525,BBCWorld : St Petersburg metro bomb victims identified https://t.co/xbtmIAxdOc (via Twitter https://t.co/IKSKX0gHOf) https://t.co/mXubnC9Lfu,All about #Info #Netizen #newsworld #Bisnis #Lokasi #wisata #travel  #komunitas pin : C00294D8E ig:ragaminfonews fb:ragaminfonews,2017-04-04T19:30:44,,,849343496410542081,ragaminfonews,2015-01-19T08:25:57,0,
268,F5F8FA,3,St Petersburg metro bomb victims identified Headline News https://t.co/NnarwGQ5Cm https://t.co/B7nCGrw0yu,Female,2017-04-04T19:30:49,"Norwell, England",,849343518736777216,VictoriaCharise,2017-02-17T12:53:25,0,
269,000000,3376,St. Petersburg Bomb Attack: Death Toll Rises to 14 https://t.co/xAx89KtQ4y,◾ News | Music | Events  ◾ Style | Fashion | Trends ◾ Web Development | Publicity BBM: 7B96C758 info@newswrita.com,2017-04-04T19:30:51,Nigeria,,849343525070282752,NewsWrita,2013-11-05T17:34:13,0,
270,000000,1169,"There's no Obama rule the GOP won't undo, including one to avert disasters like the West, TX fertilizer explosion. https://t.co/GmgA3M18si","Covering labor, trickle-down economics 3.0, and politics @theprospect. Tips: jmiller@prospect.org",2017-04-04T19:30:53,"Washington, DC",,849343534448525312,by_jmiller,2011-12-17T21:00:19,0,
271,000000,1445,St Petersburg metro bomb victims identified https://t.co/ob6WviRjPt - RT and follow @WebAdvisorInfo!,Web-Based Advice and News Center,2017-04-04T19:30:54,"Carbondale, PA",,849343538580140033,webadvisorinfo,2015-05-22T16:30:13,0,
272,C0DEED,721,Islamic State (ISIS) Celebrates St. Petersburg Subway Bombing That Killed 10 https://t.co/4aKNy9Hggu via @pamelageller,"NY Giant Fan Forever - Former New Yorker - Family on NYPD & NYFD - Believer in the True God of the Bible & the Red, White & Blue!",2017-04-04T19:30:54,Donald J. Trump for President,,849343540832477184,Polar_Bear_West,2013-09-30T23:33:57,0,
273,000000,300,#Explosion Westville man burned in explosion - WSBT-TV - WSBT-TV Westville man burned in explosion WSBT-TV ''Al... https://t.co/sBOvHzP5V5,Your One Stop Source for News,2017-04-04T19:30:55,,,849343542141046784,AllNewsDaily,2012-01-01T02:18:02,0,
274,C0DEED,146,@ben_copson @LKrauss1 @joerogan When the dinosaurs were around were CO2 levels higher? During the Cambrian explosio… https://t.co/EGaMLXBZ7P,The realest man you could ever know,2017-04-04T19:30:55,,,849343544208883715,joecugo,2013-09-07T15:33:00,0,
275,C0DEED,9,BBC St Petersburg metro bomb victims identified - Among those killed was a doll-maker who protected her daughte... https://t.co/hA6GTFhHlW,,2017-04-04T19:31:01,,,849343569877970947,RLUYOVICENTE,2010-12-27T04:12:15,0,
276,FFFFFF,903,BBC: St Petersburg metro bomb victims identified - Among those killed was a doll-maker who protected her daught... https://t.co/3R1PBU3vhg,"Following important breaking news in politics, education, South Korea, USA, Canada, and around the world.",2017-04-04T19:31:04,"Seoul, Korea",,849343583345922050,garyprogressive,2009-06-11T12:36:18,0,
277,E3E3E3,284035,Anschlag in St. Petersburg: Putin muss sich neu erfinden https://t.co/Iz9NZWtA4q,Hier twittert das Handelsblatt-Team ausgewählte News. Dazu erhalten Sie aktuelle Nachrichten als Newsfeed. Impressum: http://www.handelsblatt.com/impressum/,2017-04-04T19:31:05,Düsseldorf,,849343584436408320,handelsblatt,2007-05-04T21:34:35,0,
278,131516,597220,I hope everyone in London/Syria/Turkey/St. Petersburg &amp;around the world knows they r in my thoughts &amp;prayers whether I tweet about it or not,"'Actors are meant to be overheard, not listened to.'",2017-04-04T19:31:06,worldwide,,849343590316863488,MattBomer,2013-06-14T13:39:57,0,
279,C0DEED,1676,Warum der Anschlag von St. Petersburg Putin hilft https://t.co/zLsfAKH1eJ https://t.co/kyRYR131ai,Das ist der offizielle Twitter-Kanal der Basellandschaftlichen Zeitung. Hier gibt es News aus der Region Basel. http://www. basellandschaftlichezeitung.ch,2017-04-04T19:31:10,,,849343605282148356,bzBaselland,2012-12-17T14:56:46,0,
280,C0DEED,153,#InTheNews - St Petersburg metro bomb victims identified - Among those killed was a doll-maker who protected he... https://t.co/qhf5nBGH24,"Teach this triple truth to all: A generous heart, kind speech, and a life of service and compassion are the things which renew humanity.      Buddha",2017-04-04T19:31:10,"Washington, DC",,849343608398503937,atbigger,2012-06-12T22:07:13,0,
281,C0DEED,425,Warum der Anschlag von St. Petersburg Putin hilft https://t.co/oEqVmJXxSB https://t.co/zwVWj5HsQf,Das ist der offizielle Twitter-Kanal der az Limmattaler Zeitung. Hier gibt es News aus dem Limmattal. http://www.limmattalerzeitung.ch,2017-04-04T19:31:11,,,849343611552632837,azLimmattaler,2011-11-29T17:21:16,0,
282,C0DEED,46,Warum der Anschlag von St. Petersburg Putin hilft https://t.co/yWhgPPo5Hp https://t.co/xqr3n5QJKT,Das ist der offizielle Badener Tagblatt Twitter-Kanal. Hier gibt es News aus der Region Baden und der Nordwestschweiz. http://www.badenertagblatt.ch,2017-04-04T19:31:11,"Baden, Aargau",,849343611422507008,azBaden,2015-05-07T08:12:41,0,
283,000000,1172,Graceful Explosion Machine - UK launch trailer https://t.co/FgddRBIQh3,VIDEO GAME NEWS & REVIEWS,2017-04-04T19:31:13,"London, England",,849343617231618048,pixelmessenger,2016-01-04T21:44:30,0,
284,0099B9,2888,"@CircusMaximus14 @Dwarfpoo @ak_mack @Mr_S_Clean I'm having false flag burn-out lately :(
Haven't even looked into S… https://t.co/tAobn8PCKP","""Bad jap"" tweets mostly gas chambers, swimming pools & cats. Pro-Goy/Anti-Bolshevik: Expose JWO ガス室のことを延々と話す困ったアカウント（携帯からの書き込み英語）http://twilog.org/jackiemopsy",2017-04-04T19:31:13,,,849343618049613825,jackiemopsy,2014-05-05T14:36:15,0,
285,C0DEED,40,I'm only interested if it's in a garage: St Petersburg metro bomb victims identified https://t.co/lCUkiHelg3,,2017-04-04T19:31:13,,,849343619463077888,RGarage90210,2015-08-05T20:00:10,0,
286,C0DEED,305,Warum der Anschlag von St. Petersburg Putin hilft https://t.co/Vmyckl8eAC https://t.co/MJYEO2wpmg,Das ist der offizielle Twitter-Kanal des az Grenchner Tagblatts. Hier gibt es News aus der Region Grenchen. http://www.grenchnertagblatt.ch,2017-04-04T19:31:13,,,849343621044346880,azGrenchen,2012-12-18T10:25:19,0,
287,015193,6914,Warum der Anschlag von St. Petersburg Putin hilft https://t.co/rnbXH1hC1c https://t.co/Tzobo29hig,"Hier gibt's News aus dem Mittelland und der Nordwestschweiz: der offizielle Twitter-Kanal der Aargauer Zeitung. https://t.co/TH9JmAAZku
https://t.co/njcMf0F6ed",2017-04-04T19:31:15,Switzerland,,849343626224295936,AargauerZeitung,2010-05-18T11:48:23,0,
288,F2138A,22608,https://t.co/xh8FQc21bg,"@Smart_Democracy advocate⚬Poet @PassaPortaBxls⚬ Politics @PES_PSE Presidency & @CHPEU⚬Fellow @ SAIS /
Founder @TurkishCoffeeB⚬
➡Poetry CD & book
https://t.co/lK",2017-04-04T19:31:15,Brussels - Türkiye - DC ,,849343627633602560,Kader_Sevinc,2010-05-18T18:48:20,0,
289,000000,24,'News Update:' St Petersburg metro bomb victims identified - Among those killed was a doll-maker who protected ... https://t.co/eMK7hfvAQJ,"Call me Bhakth, Sanghi whatever, I'm  not!! I'm a true communist and I'm  here for the nation. Let's  eradicate the Congress plague from our country",2017-04-04T19:31:17,India,,849343637267894274,dartfacts,2015-02-18T06:33:02,0,
290,1E1E1E,411,"&gt;leaving out saint petersburg

REEEEEEEEEEEEEEEEEEE https://t.co/5SFMQcKWE0",chrome-lined smoke clouds left behind,2017-04-04T19:31:19,faraway places ㏌side your mind,,849343644943482881,spedru,2014-05-15T02:42:04,0,
291,C0DEED,1113,Warum der Anschlag von St. Petersburg Putin hilft https://t.co/t1spsGOcnO https://t.co/VqavZlddg0,Das ist der offizielle Twitter-Kanal der az Solothurner Zeitung. http://www.solothurnerzeitung.ch.,2017-04-04T19:31:24,,,849343667101999104,azSolothurn,2012-12-17T15:58:17,0,
292,C0DEED,603,St Petersburg metro bomb victims identified https://t.co/n4QmilPgri,All the latest world news - 24/7,2017-04-04T19:31:25,,,849343669534691333,B2WorldNews,2012-09-20T19:38:10,0,
293,C0DEED,2580,Warum der Anschlag von St. Petersburg Putin hilft https://t.co/5VFB3PWNmV https://t.co/RS3AVjNus6,Basler Ausgabe der Basellandschaftlichen Zeitung. Hier gibt es die News aus der Region Basel. http://www.bzbasel.ch,2017-04-04T19:31:25,"Basel, Schweiz",,849343670717468672,bzBasel,2012-07-18T07:25:11,0,
294,131516,555,St Petersburg metro bomb victims identified https://t.co/JH7ezz6hB1 https://t.co/chpVPdJrFl,"Count Your Age by Friends, Not Years. Count Your Life by Smiles, Not Tears",2017-04-04T19:31:26,São Paulo,,849343672516829186,Fabiolucv,2010-01-21T17:56:09,0,
295,131516,568,St Petersburg metro bomb victims identified https://t.co/mdaRS25SvS,Recognising trends as early as possible. Current Affairs / Technology / Design / Comedy / Video / Photography / Charity / Art / Trending,2017-04-04T19:31:27,,,849343676266557443,JustSeenThis,2012-09-23T12:23:53,0,
296,131516,555,St Petersburg metro bomb victims identified https://t.co/HxFxRv3cfB https://t.co/XZEqTN3HTw,"Count Your Age by Friends, Not Years. Count Your Life by Smiles, Not Tears",2017-04-04T19:31:31,São Paulo,,849343696168509440,Fabiolucv,2010-01-21T17:56:09,0,
297,C0DEED,1639,Distillery near Tampa puts St. Petersburg artisanal spirit culture back on the map #gin #craftgin… https://t.co/VDQEjWAnud,"Anthony Sexton #distiller  producing @hiddenworldgin @vaionegin. Tune in for #Gin related #news, insights and #fun! #craftgin http://www.craftgin.co.nz",2017-04-04T19:31:33,,,849343701751132160,TheGinGuyNZ,2014-12-23T03:41:04,0,
298,F5F8FA,62,Yah thank your fucking sick man I elected https://t.co/R8gWuasFbm,"Politica , Finanza, Science , Attualità , Literature , Performing Art, The World",2017-04-04T19:31:36,The World ,,849343717110689792,DorianaInfo,2016-05-28T17:54:32,0,
299,C0DEED,862,#سوريا #حمص #حلب St Petersburg metro bomb victims identified https://t.co/g4sNBuQUlV,"Syrian Soldier - الجندي المجهول 
http://syriansoldier.wordpress.com/
https://www.facebook.com/awsos",2017-04-04T19:31:38,SYRIA,,849343722177298432,awsyrian1,2012-06-06T13:24:29,0,
300,333333,9682922,Analysis: London got international condolences when terror hit. St. Petersburg got silence. https://t.co/hVHn6rV66C,"Tweet-length breaking news, analysis from around the world. Founded in 1877. Follow our journalists on Twitter: https://t.co/VV0UBAMHg8",2017-04-04T19:31:39,"Washington, DC",,849343726703005696,washingtonpost,2007-03-27T11:19:39,0,
301,F5F8FA,2,St Petersburg metro bomb victims identified : https://t.co/8TFBafsESa https://t.co/eGls5Q1u3E,auto running now,2017-04-04T19:31:39,日本,,849343726933692418,mojagebot,2016-12-28T09:34:52,0,
302,F5F8FA,15,Good thing we don't understand their motive. https://t.co/Lanx9xRR2V,Mom. Wife. Nana. Shoe-loving Pittsburgh Steeler Fan. Living on a Lake and Pining for Summer ☀️,2017-04-04T19:31:39,"Canandaigua, NY",,849343730280787968,ShoeLoverLL,2015-12-30T18:15:01,0,
303,000000,6038,Death toll reaches 14 https://t.co/k4DcIglSr0,❤ Hardcore Nationalist ❤Straight talk❤Ex_Army Officer❤No DM❤,2017-04-04T19:31:40,INDIA,,849343733195845635,activator_n,2014-03-25T06:23:08,0,
304,000000,138,Graceful Explosion Machine - UK launch trailer https://t.co/cA67rAQCdK #gaming,"GAMER KIDDIE is the best place for PC, Xbox and PlayStation Game plays, Trailers, Gaming Hacks/Cheat and much more..! https://www.facebook.com/gamerkiddieYT",2017-04-04T19:31:41,United States,,849343737369169920,gamerkiddieYT,2013-10-02T14:26:01,0,
305,C0DEED,615,St Petersburg metro bomb victims identified - Among those killed was a doll-maker who protected her daughter fr... https://t.co/pdKszs1ABd,"Get the latest World News, International news from Africa, Asia-Pacific, Europe, Latin America, the Middle East, South Asia, Canada & United States of America.",2017-04-04T19:31:45,World,,849343751357165572,Worldnews_Media,2013-11-26T17:58:57,0,
306,C0DEED,102,😢🙏💔 Pray for Saint- Petersburg https://t.co/fJKEDDfWT6,"Infinity. Where knowledge there is no edge. Who will shed all of this light. Someone to compare her i could. INFINITY, ETERNITY, GOD ⏳⌛♻",2017-04-04T19:31:47,,,849343762501423106,OShepeleva86,2013-11-24T14:29:21,0,
307,F5F8FA,14,Kyrgyzstan: Ex-neighbour Of Suspected St. Petersburg Bomber Remembers Him As (pls RT↺❤️) ️️ https://t.co/mApYQFDPpq #n,Latest Video Leaks Daily:,2017-04-04T19:31:47,,,849343763390529537,KnowVidLeaks,2017-02-09T18:17:26,0,
308,000000,137318,"St. Petersburg'taki patlama 'intihar saldırısı olabilir'

https://t.co/sVGbaEMoqj https://t.co/Dhe1jKGHdl",Gerçekler Sadece Gerçekler,2017-04-04T19:31:49,Türkiye,,849343771976368129,Haberdar,2009-02-20T18:12:28,0,
309,131516,4091,"Mañana sale lo nuevo de ALIEN ROCKIN' EXPLOSION

https://t.co/ugb4GrItiY @ARExplosion @RockEstatalRec https://t.co/w6ggdRgRhd","Web independiente de apoyo a Heavy, Metal y Rock, si quieres contactar con nosotros, no lo dudes,  MetalKorner@MetalKorner.com",2017-04-04T19:31:52,Ronda,,849343781556146176,MetalKorner,2012-11-21T00:25:16,0,
310,000000,541,We know that Russian lives are not important according to the western brothers https://t.co/kXNIejDz4P,Catholic,2017-04-04T19:31:53,With You!,,849343786702471169,chukwukahpaul,2010-11-04T12:50:31,0,
311,C0DEED,169,Russia confirms identity of St Petersburg suicide bomber https://t.co/dNmTQN5oBa #News https://t.co/79LnRxCauh,Latest Breaking News - Worldwide,2017-04-04T19:31:56,,,849343798492749824,24HourMedia,2015-09-20T16:20:02,0,
312,022330,123,Gostei de um vídeo @YouTube https://t.co/UJ5TRhtVEj Hillbilly Moon Explosion – Jackson (feat. Sparky from Demented Are Go),passarinho que come pedra...,2017-04-04T19:31:59,Recife,,849343811042070528,ellenovska,2010-04-08T21:44:05,0,
313,709397,8482,Qui Radio Londra: St Petersburg metro bomb victims identified https://t.co/YZvzCP2oRd,Notizie dal mondo in memoria del colonnello Harold Stevens.,2017-04-04T19:32:03,Europa centrale,,849343827542507520,RadioLondra_,2013-07-13T10:23:22,0,
314,C0DEED,124,St Petersburg metro bomb victims identified https://t.co/FvlsIoOmHr,Software Support Manager  php mysql lamp linux perl python open source,2017-04-04T19:32:06,"San Ramon, California",,849343839907323906,sydaly,2009-01-20T16:55:37,0,
315,F5F8FA,229,"Wie war das mit den #Bildungsverlierern und #Abgehängten...Ach ja, die wählen nur #AfD... https://t.co/HQCEKp01m9",AfD Kreisverband der Stadt Halle / Saale,2017-04-04T19:32:06,"Halle (Saale), Deutschland",,849343841509441536,AfDKVHalle,2017-02-26T12:24:25,0,
316,ACDED6,372,St Petersburg metro bomb victims identified https://t.co/ufFVBwNmIx,Ticket brokers are generating hell of a income by http://ticketbots.net 's software in terms of ticket buying and selling tickets.,2017-04-04T19:32:07,,,849343845112446978,ticketingbot,2010-05-13T11:30:17,0,
317,C0DEED,3051,24 Facts about Moscow and St Petersburghttps://www.raiseyourbrain.com/24-facts-about-moscow-petersburg/,,2017-04-04T19:32:07,,,849343846739845121,RaiseYourBrain,2015-12-08T12:27:39,0,
318,131516,96,Aanslag Sint-Petersburg mogelijk werk Kirgizische zelfmoordterrorist https://t.co/9s08L4EqR4 #MvDnl,,2017-04-04T19:32:07,,,849343846865612801,MrvanDalenNL,2013-03-17T12:20:59,0,
319,1A1B1F,2304,St Petersburg metro bomb victims identified https://t.co/7toUeoB92G https://t.co/kcf33duimP,24/7 (mostly) Tech news,2017-04-04T19:32:08,Near Acropolis,,849343848509829120,izybit,2009-05-25T15:13:11,0,
320,C0DEED,20976,BBC News - St Petersburg metro explosion kills 11 in Russia https://t.co/LVoX9bU3IQ,Adjunct Professor. Member Association Of Former Intelligence Officers (AFIO). Author. Try out my Caribbean/Florida Keys CIA spy thriller series here:,2017-04-04T19:32:08,,,849343851529732096,Robert4787,2010-09-07T04:45:04,0,
321,F5F8FA,5961,St Petersburg metro bomb victims identified https://t.co/wmAA78KphO https://t.co/nVrjsOULbd,"Informative blog, which seeks to issue any news. 
You click, you do the captcha, 3 seconds and news",2017-04-04T19:32:09,Estados Unidos,,849343854268559360,globalnews312,2016-10-08T18:40:04,0,
322,000000,2480,Possible shocking development in the Saint Petersburg attack https://t.co/zKHzAMz8MJ,Lil lovely pseudo-bug with a tendency for genocide.  Allegedly very gay  #AltFurry #AltPokemon,2017-04-04T19:32:10,Texas,,849343856437022720,King_of_random,2012-01-02T18:13:33,0,
323,F5F8FA,993,frische Teen Explosion Release https://t.co/l17uLrjRqQ,,2017-04-04T19:32:10,,,849343856512466948,olmerfomina,2016-04-15T00:01:56,0,
324,C0DEED,2581,"Banjir Protes, Menara Eiffel Akhirnya Dipadamkan untuk St. Petersburg https://t.co/Yg56TaQYeF https://t.co/CzynK8XNAu",Hanya orang biasa,2017-04-04T19:32:10,"ÜT: -6.1877654,106.8234765",,849343860115468288,Don_Banjarnahor,2009-10-12T14:53:12,0,
325,000000,775,St Petersburg metro bomb victims identified https://t.co/4Gl5rhdgR0 https://t.co/6w1WXLe1iJ,journalist commissioned to follow the mandate of President Donald Trump!,2017-04-04T19:32:11,"Washington, DC",,849343863680585729,TomYorkNews,2017-01-28T04:49:39,0,
326,000000,1463,St Petersburg metro bomb victims identified https://t.co/2SfsVauOoM https://t.co/QuNZrblYJc,"Tra scheletri nell'armadio e sogni nel cassetto, non so più dove mettere i vestiti ",2017-04-04T19:32:12,"England, United Kingdom",,849343864674693120,cinthiabros_97,2017-02-02T18:51:57,0,
327,C0DEED,260,St Petersburg metro bomb victims identified https://t.co/iG81HNTYKy https://t.co/LtDkpqWDMk,Student/Die Hard Fan Of Messi/ Fan Of Germany Football Team/ Die Hard Fan of @MANUTD / Life is all about @akshaykumar,2017-04-04T19:32:12,"Kolkata, West Bengal",,849343865060458496,suvodeepchandra,2014-06-17T06:49:10,0,
328,C0DEED,295,St Petersburg metro bomb victims identified https://t.co/aUduqnAjcU https://t.co/nDu7nPqHcp,Entrepreneur.,2017-04-04T19:32:12,,,849343865865863168,AngeloPlacencia,2010-02-17T01:34:12,0,
329,3B94D9,16470,"""St Petersburg Metro bomber identified"" https://t.co/yQbySGJunH",#News #Thailand #ข่าวสาร #ประเทศไทย #NakhonSiThammarat #นครศรีธรรมราช #การเมือง #ค่าครองชีพ #เศรษฐกิจ #ที่นี่เมืองนคร #Thai #ข่าว #Twitter #เมืองคอน #การจราจร,2017-04-04T19:32:13,"นครศรีธรรมราช, ประเทศไทย",,849343870127267840,nakhon224,2009-10-30T04:39:01,0,
330,FFFFFF,234,"Someone with a brain &amp; heart:""Why did the liberals care more about 4 dead in London than 14 dead in St Petersburg?"" https://t.co/S3IbS2FHE7","Italian Architecture & Fine Art photographer in Costa Smeralda, Italy & Moscow, Russia. I love art, literature, tech & more. Not politically correct.",2017-04-04T19:32:14,Italy,,849343876368347137,andrea_bianco,2008-09-25T16:22:30,0,
331,C0DEED,536,St Petersburg metro bomb victims identified https://t.co/SBrJeZrpkY https://t.co/NX0idpihw5,Am just me...ODUYEBO OLUWAJUWONLO...,2017-04-04T19:32:16,Lag,,849343883137953793,dexkool90,2013-12-22T09:09:45,0,
332,C0DEED,387,Bu durumda Reina saldırısına benziyor https://t.co/QpZ85tEAto,İstanbul - Turkey. . Turizm,2017-04-04T19:32:17,"İstanbul, Türkiye",,849343888074649600,nilsthekuzeyli,2010-10-12T19:54:04,0,
333,C0DEED,11,NYet: Empire State Building lights up for UNC instead of St. Petersburg bombing https://t.co/8ZhqlBVzZY,,2017-04-04T19:32:18,,,849343893292404737,Ndakoma,2011-09-07T00:42:23,0,
334,DD2E44,6240,BBCWorld: St Petersburg metro bomb victims identified https://t.co/N3RhkMuVB0,"PROUD GAY ATHEIST AND #THERESISTANCE #socialist ACTIVIST, POLITICS, NEWS, & SOME NSFW CONTENT OH YEAH & I WEAR BRIEFS my Amazon list http://goo.gl/e8DDN2",2017-04-04T19:32:19,MOTHER EARTH (PROTECT HER),,849343895347527681,STERLINGMHOLMES,2010-06-09T19:40:20,0,
335,C0DEED,1014,St Petersburg metro attack https://t.co/CTtRrOEaiY,,2017-04-04T19:32:19,London,,849343895335047169,Daveyone1,2010-03-12T09:18:41,0,
336,C0DEED,5815,St Petersburg metro bomb victims identified https://t.co/CgyTqw6hZZ,Global  News  by __________________ __________________________________ ( .@illuminati_00 .)  ____________ _____ @Global_00 _______________ ______  T j    Parker,2017-04-04T19:32:20,"Washinton D.C. ,,,  U.S.A,",,849343901194440713,Global____News,2014-12-30T20:29:53,0,
337,000000,99382,https://t.co/5TxneGt9iW – St Petersburg metro bomb victims identified https://t.co/BLqRAD4hqn https://t.co/ckflNC33nF,"Sugar Babes Get Cash Tips For Selfies & Sugar Babe Offers From Rich Tipper Addicts @ http://Tipper.GOLD , http://TipMe.Live",2017-04-04T19:32:20,,,849343901135667205,vote4princess,2015-10-03T16:09:42,0,
338,DD2E44,6240,BBCWorld: St Petersburg metro bomb victims identified https://t.co/MCaLJtoqcR,"PROUD GAY ATHEIST AND #THERESISTANCE #socialist ACTIVIST, POLITICS, NEWS, & SOME NSFW CONTENT OH YEAH & I WEAR BRIEFS my Amazon list http://goo.gl/e8DDN2",2017-04-04T19:32:21,MOTHER EARTH (PROTECT HER),,849343903077740544,STERLINGMHOLMES,2010-06-09T19:40:20,0,
339,3B94D9,16470,"#BBC ""St Petersburg metro bomb victims identified"" https://t.co/XSMVL9kEld",#News #Thailand #ข่าวสาร #ประเทศไทย #NakhonSiThammarat #นครศรีธรรมราช #การเมือง #ค่าครองชีพ #เศรษฐกิจ #ที่นี่เมืองนคร #Thai #ข่าว #Twitter #เมืองคอน #การจราจร,2017-04-04T19:32:22,"นครศรีธรรมราช, ประเทศไทย",,849343910560268288,nakhon224,2009-10-30T04:39:01,0,
340,C0DEED,1622,St Petersburg metro attack https://t.co/vCQQEqRARA,If we starve the fuel ( Money) from this industry we stand a better chance to see JUSTICE!,2017-04-04T19:32:23,Worldwide,,849343911751553025,BoycottFamilyLw,2013-04-08T13:35:19,0,
341,000000,135956,https://t.co/gd1goHIndz – St Petersburg metro bomb victims identified https://t.co/oLpbphSUun https://t.co/f9KCSbCefC,,2017-04-04T19:32:23,Australia,,849343912036716545,GossBossFans,2015-07-24T05:27:07,0,
342,F5F8FA,15,St Petersburg metro bomb victims identified https://t.co/6cXyaY9ZVe https://t.co/8h1KXQ6ZvK,News International Music Government & Politics World News,2017-04-04T19:32:24,,,849343915530403840,newcocol,2017-01-18T23:09:53,0,
343,000000,91759,https://t.co/1QjxNweBwO – St Petersburg metro bomb victims identified https://t.co/3RwRYNHCh5 https://t.co/NwcgOui959,"World News, MMA News, Sports, Entertainment News and More",2017-04-04T19:32:25,"Australia, USA, World",,849343921260023808,realnewsco,2015-08-14T08:47:47,0,
344,C0DEED,176,St Petersburg metro bomb victims identified https://t.co/dom48Wb8je,,2017-04-04T19:32:27,,,849343930709757957,testrssnews,2013-01-19T23:41:11,0,
345,EDECE9,50,"Quelle tristesse ce monde
Idlib &amp; Saint Petersburg","I wish you all peace, love and joy.",2017-04-04T19:32:28,"Paris, France",,849343933180203008,sosegalil,2011-05-24T06:01:38,0,
346,000000,1175,"Explosion in a St Petersburg metro station, casualties reported - Russian media https://t.co/nc3zt2bREq by #NazerineP via @c0nvey",@CIubeFoIIowBack #JuntosSomosMais,2017-04-04T19:32:29,"Porto Alegre, Brasil",,849343939232641033,SurisAndre,2015-01-01T15:34:35,0,
347,000000,29644,RIP to all the victims at #Petersburg #attack. Very sad news.,Actress Humanitarian #Producer  #Entrepreneur #FitnessGuru #Voiceovers #Speaker Instagram: BirJulie - I Tweet Fun & Fact information: https://t.co/QuzhMDDogs,2017-04-04T19:32:31,Worldwide,,849343944966242304,juliebir,2009-06-28T22:12:17,0,
348,C0DEED,434,PeterTownsend7: The problem with 'Public Vigilance' #petersburg   #london #londonattack #tcot  https://t.co/QWXqpySwpb  …,Islamic ideology is the antithesis of Western Civilization.   https://www.facebook.com/frederick.morrison.731,2017-04-04T19:32:32,United Kingdom,,849343949529632768,Luandrew169,2013-01-04T11:01:25,0,
