id,user_bg_color,user_followers,text,user_description,created,user_location,coordinates,id_str,user_name,user_created,retweet_count,geo
177,00589C,474671,"► Gran susto por explosión de camión de gas (Fotos)
‗‗
https://t.co/ihK6kyG0My
 https://t.co/Ysc36lhoku",Noticias de Venezuela y el Mundo en Español. Cadena de Noticias @EP_Mundo Facebook: http://facebook.com/EP.Venezuela,2017-04-04T19:27:58,Venezuela,,849342800172920835,periodicovzlano,2011-04-30T06:25:52,0,
178,000000,100639,"► Gran susto por explosión de camión de gas (Fotos)
‗‗
https://t.co/xz0zWsGzsq
 https://t.co/UVExJzYkEm","Noticias de Venezuela y el Mundo en Español. Cuenta alterna del @periodicovzlano. 
Cadena de Noticias @EP_Mundo

Síguenos en Facebook: https://t.co/yIC8YZ9sJO",2017-04-04T19:27:58,Venezuela,,849342802324590598,EP_VEN_Noticias,2012-07-21T01:11:44,0,
179,C0DEED,559,"Pray for St. PETERSBURG Terroris Attack
https://t.co/CyraRwrG84
#StPeterburgBlast 
#StPetersburg 
#TerroristAttack 
#prayforstpetersburg",VENTA DE GARAJE http://www.kukustylevzla.ga/,2017-04-04T19:28:00,Venezuela,,849342810012569600,kukustylevzla,2015-09-13T19:15:26,0,
180,C0DEED,13,Trust in humanity restored: How St. Petersburg united in face of terrorism https://t.co/Cw8DXdowvB,,2017-04-04T19:28:00,"Bogota, Colombia",,849342810872582144,pureason,2009-05-28T19:49:48,0,
181,051117,25,So sorry... My thoughts with you Saint Petersburg...😞😞😞 #PrayforStPetersburgh,"Never stop dreaming. We are all lying in the gutter, but some of us are looking at the stars... Love and kisses. /JenyaHF/",2017-04-04T19:28:02,England,,849342817025634305,iamJenyaHart,2012-06-13T04:36:02,0,
182,131516,473,Anschlag in St. Petersburg: Putin muss sich neu erfinden: Der Attentäter von St. Petersburg… https://t.co/thWMNT1n92,EazyForm.de Werbeagentur - Wir erstellen Interaktive PDF Formular-Lösungen nach Ihren Anforderungen und Vorgaben.,2017-04-04T19:28:04,Augsburg Germany,,849342825414225922,EaZyForm,2012-05-29T16:23:46,0,
183,FF6699,610,St. Petersburg metro blast by Kyrgyzstan suicider https://t.co/fOoRCBcwqX,"I'm the Israel editor at BeforeItsNews.com, the biggest community of citizen newsmakers and breakers. Read more or join for free to add your own articles...",2017-04-04T19:28:04,,,849342825548443648,B4INIsrael,2012-03-08T13:33:56,0,
184,ABB8C2,58284,"► Gran susto por explosión de camión de gas (Fotos)
‗‗
https://t.co/ck5yXgtW56
 https://t.co/bo9LXkjl5f","Noticias de Venezuela y el Mundo en Español. Cuenta alterna del @periodicovzlano. Cadena de Noticias @EP_Mundo 
Síguenos en Facebook: https://t.co/yIC8YZ9sJO",2017-04-04T19:28:06,Venezuela,,849342834742362115,EP_VEN_24horas,2013-08-13T02:39:00,0,
185,F5F4F2,71152,St. Petersburg metrosundaki saldırıyı soruşturan yetkililer failin Kırgız kökenli olabileceği üzerinde duruyor… https://t.co/US8IlDgfPl,Deutsche Welle Türkçe'nin resmi Twitter hesabı.,2017-04-04T19:28:06,Germany,,849342834608099331,dw_turkce,2009-07-28T21:12:26,0,
186,C0DEED,670,"yewwNEWS St Petersburg explosion: Russian media wrongly names man as attacker |… https://t.co/9ZqhMXZq4J, see more https://t.co/Ue2IiIqto1","A News Info Site from gen XYZ's perspective.

AUTOMATIC REAL TIME CONTENT CURATION.

16 LISTS OF 1500+ TOP SOURCES

***BE EXCITED BY SOMETHING NEW***",2017-04-04T19:28:08,,,849342841109311490,YEWWinfo,2012-11-08T16:41:33,0,
187,642D8B,291,"We Working... lil bih!
@moedirdee ydbid313 and #TeamDirdee present
SPRING EXPLOSION 2017... This… https://t.co/2EeeiO6ULn","I am just trying to be my own kind of great. I'm on my own path, in my own lane. Just let me Live, Let me be Great, Let me be Danie...",2017-04-04T19:28:09,Detroit,,849342847753039872,ImJustDanie,2010-08-27T04:06:28,0,
188,9AE4E8,3565,"As Russia mourns St Petersburg attack, Europe shows little solidarity - CNN https://t.co/QaW532mHsC",Follow us to get the latest news about Russia,2017-04-04T19:28:10,,,849342851356008450,RussiaNewsDaily,2010-12-01T01:55:20,0,
189,B78080,2220,St Petersburg metro bombing suspect 'from Kyrgyzstan' @AJENews  https://t.co/RIlQzLEnrm,Nashville is not just for cowboys!,2017-04-04T19:28:13,"Nashville, TN  USA",,849342864077279232,MsNashville,2009-05-11T17:39:30,0,
190,ACDED6,1059,I curse the supreme evil of terrorism and all agents of terrorism in this world that attack innocent civilians like… https://t.co/f6EMHRibCW,"Academic.Vegetarian.Tweets frm the East & the West. Mostly MidEast, Intl. Affairs,Conflict.Loves all animals inc.humans.#HAYIR",2017-04-04T19:28:16,"Moscow, Russia",,849342878128238593,fatmaulgen,2013-03-24T14:00:49,0,
191,65582E,2584,"Just In&gt;&gt; ""
Body found in booby-trapped home after explosion
      "" 
https://t.co/H9oR5U6Ane","Twitter + ALL the News = PERFECT!

Visit and enjoy our YouTube channel: https://t.co/1fIjsw6sDJ  

Facebook Page: https://t.co/Oaf97jQpPi",2017-04-04T19:28:17,Digitosphere,,849342882905567236,Ubertr0_nNub,2012-06-05T23:26:03,0,
192,8A0808,1661,"Strangely, nor even in Greece. https://t.co/FJLRSRVEVg","Born in İstanbul, Turkey. Spent twelve years in the US. Currently lives in Athens. Has worked for an educational program for Muslim minority children in Thrace.",2017-04-04T19:28:23,"Athens, Greece",,849342906393665538,DimoYagcioglu,2009-09-27T21:58:08,0,
193,BF1238,8300,St. Petersburg metrosundaki saldırıyı soruşturan yetkililer failin Kırgız kökenli olabileceği üzerinde duruyor… https://t.co/YoRE3dkR6s,"Turkey's Progressive Voice in Brussels - CHP European Union Representation -CHP Avrupa Birliği Temsilciliği, Brüksel",2017-04-04T19:28:23,Brussels,,849342907320553472,CHPEU,2009-06-23T13:37:50,0,
194,C0DEED,29592,Is anyone here a Potion Explosion fan? Let's play. My username is NextOnTCM.  https://t.co/YllvZ9GE25,Every movie on Turner Classic Movies tweeted one hour in advance. Eastern time zone listings. // Follow @NextOnTCM_PT for Pacific time zone.,2017-04-04T19:28:25,I don't work for TCM.,,849342916157992960,NextOnTCM,2011-04-06T21:17:18,0,
195,C0DEED,915,Eiffel Tower to dim its lights for St. Petersburg attack victims after public outcry https://t.co/7MCA8VGy0h https://t.co/fZrT656QrV,,2017-04-04T19:28:25,,,849342915600154626,TheDailyDigest,2009-01-14T23:11:27,0,
196,F5F8FA,221,Blast on the St. Petersburg subway - VOA TV Ashna https://t.co/EK6QiBMQPk &gt;Blast on the St. Petersburg subway - VOA… https://t.co/HmPeRYbRvc,,2017-04-04T19:28:33,Afghanistan,,849342948168921090,NewsUpdatesAf,2016-09-30T12:55:25,0,
197,C0DEED,797,"Apparently, ""a massive explosion that swallows up Old Trafford and both teams"" is not an acceptable answer to the preference for the result!",Liverpool through and through. Recently moved to Atlanta so getting involved with the launch of @ATLUTD  #RedsRoseWalk,2017-04-04T19:28:36,,,849342961301286914,Hansensleftboot,2012-03-25T19:03:52,0,
198,000000,6,Analysis | London got international condolences when terror hit. St. Petersburg got silence. https://t.co/B7KmJiYVCl,Knowledge management; information consultant. Tweeting since 2009.,2017-04-04T19:28:37,Online,,849342964094709761,eyes0nly_,2017-01-25T06:48:05,0,
199,C0DEED,103,La fabricación de petardos es más peligrosa que la fabricación de ciertos explosivos. Pobre gente. https://t.co/CAcuLMwxiw vía @abc_es,Estas son mis opiniones. Pero si no te gustan estoy dispuesto a explicarte las que sean de tu agrado. Es mentira. Vete a otro perfil.,2017-04-04T19:28:52,Tordera,,849343025650249728,Naplita2,2010-11-06T19:26:55,0,
200,F5F8FA,105,Ya think?! https://t.co/mlzpwyI4Ja,,2017-04-04T19:28:56,"Cary, IL",,849343044004589568,MarkDHilbrink,2016-02-29T16:34:54,0,
201,C0DEED,147,Seven feared dead after huge explosion tears through fireworks factory https://t.co/upkc6LtJbW via @MetroUK,"befreit von christlicher Zwangsdomptur, gegen JEGLICHE Einflussnahme von Religionen, Kirchen und selbsternannten Gurus auf die Bevölkerung",2017-04-04T19:29:00,,,849343062895669248,ellibisathide,2013-09-06T12:29:27,0,
202,C0DEED,1000,Is anyone here a Potion Explosion fan? Let's play. My username is NextOnTCM.  https://t.co/SfWG2bLn2y,Every movie on Turner Classic Movies tweeted one hour in advance. Pacific time zone listings. // Follow @NextOnTCM for Eastern time zone.,2017-04-04T19:29:02,I don't work for TCM.,,849343071586222085,NextOnTCM_PT,2015-03-28T23:48:59,0,
203,C0DEED,561,Technological Institute metro station in #StPetersburg after Monday's explosion https://t.co/SAPJFFP7fo,Reporter @reuters @JewishJournal | Previously @Bloomberg @LABJ @USCAnnenberg alum | Opinions are my own | olgareports@gmail.com,2017-04-04T19:29:07,"Los Angeles, CA",,849343088623570944,OlgaGrigory,2013-09-01T04:23:23,0,
204,000000,40,"10 people have been killed &amp; 50 are injured after deadly blasts rock St. Petersburg subway, Russian media reports… https://t.co/eGyHHT1KYA…","I will keep the stories 
that you inspire in my memories.",2017-04-04T19:29:07,"Rotterdam, The Netherlands",,849343090112552960,Aroiiy,2017-03-22T11:07:16,0,
205,C0DEED,1995,Que en penses @RaholaOficial ? https://t.co/KYmCqNv3nq,Ningú pot aprendre el que creu que ja sap,2017-04-04T19:29:07,#RepúblicaCatalana,,849343090355838976,Rosbyt,2012-11-28T15:46:12,0,
206,C0DEED,435,#RT RussiaToday: NYet: Empire State Building lights up for UNC instead of St. Petersburg… https://t.co/5D84pt9byC,We Tweet @TheBrkNews From World Wide.  #Business #Entertainment #Sports #Politics #Live #Videos #Headlines #News !,2017-04-04T19:29:14,World Wide Web,,849343121263558656,BN365,2015-09-19T04:15:41,0,
207,B2DFDA,113,Terrorismus: Ermittler: St. Petersburg-Attentäter stammt aus Kirgistan - FOCUS Online https://t.co/Xp9t2E93cg #kreativität,Deutsche Kreativitätspresseschau - Vorredaktioneller Bot,2017-04-04T19:29:20,,,849343146227941376,op3kreativnews,2012-11-14T15:18:15,0,
208,000000,188,BBC News - St Petersburg metro explosion kills 11 in Russia #StPetersburg https://t.co/EioDx3pXhI,"Arabian, Egyptian, Dreamer, Academic, President of Arabian Academy for Science and Technology.",2017-04-04T19:29:21,Egypt,,849343150221139968,dr_abuzeid,2011-10-07T21:57:27,0,
209,C0DEED,282,Yes I think we now know what Putin asked Trump when they spoke after the St Petersburg attack #Syria #ChemicalAttacks,"International Relations and Global Democratization;
Co-author of The Triumph of Democracy and the Eclipse of the West http://ewanharrison.com",2017-04-04T19:29:21,"Princeton, NJ",,849343150858657792,reoharrison,2013-01-09T19:08:46,0,
210,F5F8FA,73,"به امید دنیای بدون ترور، جنگ، افراطی گری
#سن_پترزبورگ #تسلیت
#Petersburg #Russia","‏‏‏‏‏‏‏‏ما زنده به آنیم که آرام نگیریم
موجیم که آسودگی ما عدم ماست | 
Political Science Student, Sound Manager",2017-04-04T19:29:22,Tehran / Qaemshahr,,849343152641249280,KabiriHosein,2017-03-18T09:29:36,0,
211,9AE4E8,8053,Brandenburger Tor und die Opfer von St. Petersburg: Die Partnerstadt-Ausrede---- https://t.co/Wm3KDyrZP2,Ich bin sehr interessiert an Geschichte und Politik- Vor allem lese und lache ich sehr gerne! Wer mir folgt muss auch mal eine andere Meinung vertragen können!,2017-04-04T19:29:23,,,849343155879235588,krippmarie,2013-06-05T14:24:45,0,
212,F5F8FA,28,Graceful Explosion Machine - UK launch trailer https://t.co/k6sw70qOAJ,http://theworldofmichaelb.co.uk is the first and only dating site for gamers and nerds,2017-04-04T19:29:24,"London, England",,849343162053218304,TWOMichaelB,2017-03-11T02:35:14,0,
213,6699CC,55129,St. Petersburg subway suicide bomb suspect ID'd https://t.co/LViuBri5bg https://t.co/J0e096nmmx,"Breaking news, weather and sports from the newspaper of record in Naples, Florida.",2017-04-04T19:29:23,"Naples, Florida",,849343158777524226,ndn,2007-11-20T21:26:19,0,
214,C6E2EE,131,"E nós sempre na contramão do mundo... @MichelTemer cortou investimentos no setor que gerava centenas de empregos, e… https://t.co/qrTgXdeLvv",talvez pode ser quem sabe,2017-04-04T19:29:25,"Guiricema, MG, BRASIL",,849343167828766720,gleniabio,2010-06-02T23:44:28,0,
215,C0DEED,914,Anger as Berlin refuses to light Brandenburg Gate in Russian colors to show solidarity with St. Petersburg... https://t.co/FUucQwC1uB,"Covering local (Sarasota County), National, and International news via major media and issues major media avoids.",2017-04-04T19:29:26,"Sarasota, FL",,849343170341203968,UncensoredRprt,2012-08-09T16:54:44,0,
216,000000,463,"En Hidalgo explota ducto de Pemex tras ordeña #Pemex #hidalgo 
https://t.co/OOtmD0E8aj",Información actualidad entretenimiento,2017-04-04T19:29:27,México,,849343172908134400,ElDigitalMexico,2016-06-08T21:39:55,0,
217,C0DEED,71,"Hey Amigos!!!! 
IPW 3rd Explosion Jungle Wars. 10th June 2017 at Wrestlingschool Suplexschmiede… https://t.co/vVAsjWWPZR","Hola amigos!
I'm a Wrestling Rookie from the EuropeanWrestlingPromotion Wrestling School.",2017-04-04T19:29:29,,,849343181326045184,MrMickito,2014-11-02T13:44:22,0,
218,F5F8FA,65,This must have been terrifying to be near two terrorist attacks while so far from home. https://t.co/PQ3P0RYVvC,"⚫⚫PSU⚫⚫                                                      ⚪⚪Cross-Cultural Marketing Studies⚪⚪     🌏🌎🌍
Anthropology, Sociology, Psychology, & Marketing",2017-04-04T19:29:29,"Vermont, USA",,849343182043308034,LyndseymBradley,2017-02-12T21:19:21,0,
219,D13828,620,One of these things is not like the other... https://t.co/5nZAZMFLLw,Refugee. Queer. Older than you. Formerly famous on the Internet. UW MACS 2016-.,2017-04-04T19:29:32,Lower Seattle,,849343196794687490,MaggyTheBrave,2007-01-23T17:49:02,0,
220,000000,9969,Bomber's body parts found in St Petersburg blast https://t.co/K3GFMowRhz,"No way that the world is strictly divided between the moralistic and dumb, on one hand, and the sexually liberated and intelligent on the other. ✴️ UnBIASed ✴️",2017-04-04T19:29:33,United States,,849343201706221569,vnuek,2016-05-24T16:40:28,0,
221,C0DEED,5470,The Hashimoto's Protocol book provides an explosion of insight! RT https://t.co/Qb8IJBvxXf,"Patient and practitioner education about #gluten-related disorders and #autoimmunity by internationally recognized researcher, speaker and workshop leader",2017-04-04T19:29:35,,,849343208249274368,theDr_com,2011-06-28T17:48:57,0,
222,318199,357,Realize that it happened in ST Petersburg NOT Leningrad.  That is significant change in Russian culture.  St... https://t.co/0g7RlMSREu,"artist , writer",2017-04-04T19:29:41, NY,,849343233561899012,DonnaWDWho,2009-08-04T00:13:48,0,
223,000000,165,come &amp; check out my pieces at Art Explosion Spring Open Studios April 7th Friday 7-11pm April 8&amp;9 Sat &amp; Sun 12-5pm… https://t.co/TRNHvjlpmI,"Visual Artist painter , BA&MA in painting",2017-04-04T19:29:41,"California, USA",,849343234899935234,FarnazZabetian,2015-05-23T00:34:37,0,
224,352726,910,Prime example of how trial by media and media-mob mentality can be so very dangerous. https://t.co/jI6YhdOf8v,American Jew abroad. Freelance writer/editor. Seen in CNN Travel | The National. Prev Asst Ed of mags @TheNationalUAE Proud nerd w/ a keen sartorial sense.,2017-04-04T19:29:44,Abu Dhabi | United Kingdom,,849343245331070977,ashleybesslane,2009-03-06T06:27:47,0,
225,C0DEED,67,Gute Pro und Contra- Auseinandersetzung bzgl des Anstrahlens des Brandenburger Tores mit russischer Flagge. https://t.co/XcSgarCSgh,Angehörige der Spezies Mensch,2017-04-04T19:29:44,"Earth, sometimes Dreamland",,849343246413291520,Irisakakruz,2015-07-19T20:53:12,0,
226,C0DEED,6977,Paris and Berlin slammed for lack of St Petersburg tribute https://t.co/3AUj4a8WsT https://t.co/9KLZZ8xfOd,"IT tech, Genealogy researcher #TheResistance #TrumpLeaks #NotMyPresident #ImpeachTrump #TrumpRussia #RussiaGate #Resist #LockHimUp #ComradeTrump #ResignNow",2017-04-04T19:29:46,"ÜT: 48.195723,-122.119899",,849343254608969728,cahulaan,2009-06-18T20:05:34,0,
227,C0DEED,624,".@MarcusC22973194 @2020pleasehurry
 Vadim Tulpanov was the former council leader of St Petersburg
https://t.co/OkFe8kbJbX","Corsets, Bodices and Heritage garments made-to-measure at no extra cost. Reasonably priced, fast turn around alteration service available.",2017-04-04T19:29:47,London,,849343260027912193,justinajuli,2014-04-05T12:58:03,0,
228,F5F8FA,1,"I'm a #virgin,and you? !  I'm there-    https://t.co/bIlZH7Z02M https://t.co/Jhu5XECNPh",,2017-04-04T19:29:48,,,849343260913012740,Jennife37884077,2017-03-31T21:51:00,0,
229,131516,396,That's a different face than what they showed a few hours ago. https://t.co/cChGmN27Vy,Prophet of The Lord our God ; king *OutLaw Mafia* 13 ✳️ • Advice • Questions • Blind judgement • Photography • ...single ☆ zaymac414mke@gmail.com,2017-04-04T19:29:49,414 (9)- ♉,,849343264805277697,ZayMac_,2010-03-27T17:04:38,0,
230,000000,27,Graceful Explosion Machine - UK launch trailer https://t.co/NOyNOb3SMS https://t.co/pp3x14a5R7,News that has to do with gaming,2017-04-04T19:29:49,"Bennington, VT",,849343266113937410,rwm_gn,2016-10-21T15:54:40,0,
231,C0DEED,303,Maybe not the best week to dance in Saint Petersburg.. #nobelfinalversion #m_division… https://t.co/JdjjgcRohb,Bookings: marija@apelago.com,2017-04-04T19:29:50,Madrid(Spain),,849343269955919874,Aiken_music,2014-11-19T20:27:43,0,
232,000000,31,St Petersburg metro bomb victims identified #news #eu https://t.co/YY7TCEksgK https://t.co/3ZEyECbCcS,"News about Brexit, UK, EU and the World",2017-04-04T19:29:52,"London, England",,849343278277423104,Brexitnews1,2017-03-11T12:02:40,0,
233,C0DEED,624,".@MarcusC22973194 @2020pleasehurry
 Vadim Tulpanov was the former council leader of St Petersburg
https://t.co/8QDCAxNT7S","Corsets, Bodices and Heritage garments made-to-measure at no extra cost. Reasonably priced, fast turn around alteration service available.",2017-04-04T19:29:52,London,,849343280261337088,justinajuli,2014-04-05T12:58:03,0,
234,318199,357,Realize that it happened in ST Petersburg NOT Leningrad.  That is significant change in Russian culture.  St... https://t.co/uKyfwdUcyh,"artist , writer",2017-04-04T19:29:58, NY,,849343305456504834,DonnaWDWho,2009-08-04T00:13:48,0,
235,F5F8FA,2069,Graceful Explosion Machine - UK launch trailer https://t.co/NzsO2LJAaZ https://t.co/cRfp4HMw7l,"All about Gaming, News, Tendences, Tricks, Guides & Support.. Follow x follow",2017-04-04T19:29:59,"California, USA",,849343307201347587,GamingTday,2016-07-23T05:44:06,0,
236,C0DEED,339,St Petersburg metro bomb victims identified. France surrenders.,Bringing you the French reaction to the latest world news.,2017-04-04T19:30:01,,,849343317645176836,franceworldnews,2013-10-26T15:31:36,0,
237,000000,1068,[ 3 April 2017 ] Mysterious cosmic explosion puzzles astronomers News - https://t.co/3VZzJ2D6s5 via https://t.co/O5WOnKxdYM,"Creator of ApaceHub
IOS Developer",2017-04-04T19:30:01,"Florida, USA",,849343317179367424,SuperChargedUX,2016-09-22T14:49:44,0,
238,000000,16,"OSHA: Probe of St. Louis Boiler Blast Could Take Months.
 An explosion launched ...https://t.co/XXsca4QUej",,2017-04-04T19:30:08,"New York, USA",,849343346489380864,fastnewsus,2016-01-18T05:41:15,0,
239,000000,1641,Flooding causes explosion of #mosquitoes in Stanislaus County; districts to seek #FEMA funds… https://t.co/0PYfIY0QAE,"Let's chat - Product Manager #Larvicides | RTs ≠ endorsements | All opinions are 100% me | Love the Earth, not #Mosquitoes",2017-04-04T19:30:10,"Chicago, IL",,849343354814988292,ProductJT,2017-03-10T19:23:35,0,
240,C0DEED,6176,"Watch ""Any Conspiracy Theory About the St. Petersburg Metro Blast Is OK So Long As It’s About Russia"" on YouTube https://t.co/36gTtsW4Sh","The current American political and geopolitical issues and World events, studies, research, Sociology, Science, Psychology and religion and their nexus",2017-04-04T19:30:11,USA,,849343359797923842,TroubledDays,2010-05-09T13:17:55,0,
241,C0DEED,6176,"Watch ""Any Conspiracy Theory About the St. Petersburg Metro Blast Is OK So Long As It’s About Russia"" on YouTube https://t.co/MJIbsl3VoN","The current American political and geopolitical issues and World events, studies, research, Sociology, Science, Psychology and religion and their nexus",2017-04-04T19:30:12,USA,,849343362494857216,TroubledDays,2010-05-09T13:17:55,0,
242,1E4559,37543,"ATF New York, @NYPDnews offering $25,000 reward for information in Central Park explosion that occurred last July. https://t.co/yCcQNCEENo","Official ATF Twitter account.
1-888-ATF-TIPS or ATFTips@atf.gov
We do not collect information through this account: http://justice.gov/doj/privacy-policy",2017-04-04T19:30:14,"Washington, DC",,849343373471346689,ATFHQ,2012-01-09T15:43:28,0,
243,C0DEED,1144,"Banjir Protes, Menara Eiffel Akhirnya Dipadamkan untuk St. Petersburg https://t.co/cA7mxwkm0g",Mau baca Kasak Kusuk cukup klik @KaskusBerita Cara cepat dapat berita dari layanan berita tercepat di Indonesia,2017-04-04T19:30:17,"Jakarta, Indonesia",,849343384288407555,KaskusBerita,2012-11-20T21:30:33,0,
244,F5F8FA,921,"The government is lying to us, yesterday the ground shook on us and they telling us ""There was an explosion in a mine""","| RHYTHM AND POETRY |
#RAP",2017-04-04T19:30:18,Pretoria  -  South Africa  ,,849343388461740032,EverythingEMZ,2016-05-09T11:34:57,0,
245,C0DEED,89,"#Residential Price: $225000. Address: 6844 9TH AVE N, St petersburg, Florida 33710  One story. MLS... - https://t.co/3AdvScFvcR",We Publish Luxury Real Estate Information To The World http://realestatemls.com,2017-04-04T19:30:21,"Naples, FL",,849343401032069121,RealEstateMLStv,2013-04-03T00:32:49,0,
246,C0DEED,334,What Is Known About Suspect In St. Petersburg Attack: Russian authorities are… https://t.co/xzwpAASnyE #travel,It's Nice to Travel with You!,2017-04-04T19:30:24,,,849343414294511617,TravelsNEW,2013-01-23T04:47:22,0,
247,FFFFFF,18915556,St Petersburg metro bomb victims identified https://t.co/TLHeTuFkBt,"News, features and analysis from the World's newsroom. Breaking news, follow @BBCBreaking. UK news, @BBCNews. Latest sports news @BBCSport",2017-04-04T19:30:25,"London, UK",,849343419155664896,BBCWorld,2007-02-01T07:44:29,0,
248,C0DEED,80,St. Petersburg Blast was Preceded by Preemptive Raids on Terror Cells https://t.co/WEBEjcOxpa,,2017-04-04T19:30:25,,,849343418476228609,altnewsheadline,2015-08-15T11:43:49,0,
249,C0DEED,334,What Is Known About Suspect In St. Petersburg Attack: Russian authorities are… https://t.co/VrEGJdxH6x #travel,It's Nice to Travel with You!,2017-04-04T19:30:28,,,849343428613812225,TravelsNEW,2013-01-23T04:47:22,0,
250,000000,1583,#5Questions: Has New Zealand seen the worst of Cyclone Debbie? https://t.co/MC9SF8isbB,"No filter, no bullshit media for young women. Real-talk, culture, feminism, news, opinions + more. #MyBodyMyTerms",2017-04-04T19:30:28,"Auckland, New Zealand",,849343428332630016,TheVillainesse,2014-11-24T09:02:41,0,
251,C0DEED,218,"Russia identifies St Petersburg bomber as Akbarzhon Jalilov, says he was... https://t.co/jkwwa1nBB2 by #BBCBreaking via @c0nvey","Workaholic, Professional, Humble",2017-04-04T19:30:27,,,849343427561041921,AlitSatia,2014-06-21T06:06:04,0,
252,FFFFFF,214479,"St. Petersburg subway blast was suicide attack, officials say https://t.co/p7Cq11Vtfc https://t.co/Yxr85umTpj","The flagship nightly news and current affairs program from Canada's public broadcaster, CBC-TV.",2017-04-04T19:30:28,,,849343431273054208,CBCTheNational,2009-03-12T18:34:23,0,
253,000000,99382,St Petersburg metro bomb victims identified https://t.co/Kjo7VA3U3P https://t.co/nqqcIh86vb,"Sugar Babes Get Cash Tips For Selfies & Sugar Babe Offers From Rich Tipper Addicts @ http://Tipper.GOLD , http://TipMe.Live",2017-04-04T19:30:28,,,849343431663116288,vote4princess,2015-10-03T16:09:42,0,
254,C0DEED,94823,PC Logic #londonattack  #petersburg   #london #londonattack #tcot  https://t.co/ycl8wBfZXZ https://t.co/cwh193acUU,Author and independent researcher focused on Islam based in Australia,2017-04-04T19:30:30,Australia,,849343437686157314,PeterTownsend7,2012-09-16T05:20:05,0,
255,C0DEED,15131,BBCWorld: St Petersburg metro bomb victims identified https://t.co/aeFDawhIwf,"#education #learning #Brazil its #language, its #food #travel Work @OpenUniversity #leadership #edtech Believe @MhairiCalveyAct will win an #Oscar 1 day",2017-04-04T19:30:31,"Thirsk, North Yorkshire",,849343441465200640,JamesRoy,2009-01-13T14:09:37,0,
256,C0DEED,1501,BBC    shocking     what happened  to journalism? https://t.co/J8DCgIBiep,"commentaar is een kado om beroepsdeformatie te doorbreken, soms persoonlijk tweets, lezer bepaalt zelf de waarde/waarheid van retweets",2017-04-04T19:30:31,,,849343444522807298,Sandra_Stork,2012-06-25T18:50:54,0,
257,000000,135956,St Petersburg metro bomb victims identified https://t.co/quIsnbqedK https://t.co/A2vrhSlIRj,,2017-04-04T19:30:31,Australia,,849343444040470528,GossBossFans,2015-07-24T05:27:07,0,
258,9266CC,107820,St Petersburg metro bomb victims identified https://t.co/WrSpJo77Rq https://t.co/yNWKxFl1Bd,"Author, Master Hypnotherapist, Master Coach, Master NLP Practitioner, Master Time Line Therapist (R), Master Trainer of TNC (R), Founder of ((CUON NETWORK))",2017-04-04T19:30:34,"Melbourne, Victoria",,849343457512521731,jordanduran,2008-10-01T03:47:46,0,
259,000000,176,"Спустя сутки, практически заставили, не верю. https://t.co/7mwg3oK6IK",неукроп,2017-04-04T19:30:35,,,849343458368249856,lelik_v_v,2015-05-11T18:04:10,0,
260,000000,135,St Petersburg metro bomb victims identified -  https://t.co/V2YnS1BuqD https://t.co/B9ozJDt1W9,"Visit Us Online
Global News - Local Delivery",2017-04-04T19:30:36,,,849343464399622145,Snorker_News,2017-01-30T06:27:17,0,
